"Villa Luzuriaga, Buenos Aires Province, Argentina",promiedos,"Mercedes, Buenos Aires Province, Argentina",coronavirus suecia,"Funes, Santa Fe Province, Argentina",argentina,"Marcos Paz, Buenos Aires Province, Argentina",síntomas del coronavirus,"Funes, Santa Fe Province, Argentina",casos de coronavirus en mendoza,"Hurlingham, Buenos Aires Province, Argentina",pagina12,"La Tablada, Buenos Aires Province, Argentina",jair bolsonaro coronavirus,"Hurlingham, Buenos Aires Province, Argentina",el coronavirus esta en el aire,"Muñiz, Buenos Aires Province, Argentina",rosario3,"Las Heras, Mendoza Province, Argentina",muertes por coronavirus en el mundo,"San Fernando, Buenos Aires Province, Argentina",mapa mundial coronavirus,"Florida, Buenos Aires Province, Argentina",coronavirus en rosario hoy,"Palpala, Jujuy, Argentina",banco nacion,"Funes, Santa Fe Province, Argentina",barcelona,"Adrogué, Buenos Aires Province, Argentina",coronavirus mendoza hoy,"Río Tercero, Cordoba, Argentina",coronavirus casos hoy,"Villa Constitución, Santa Fe Province, Argentina",0223 coronavirus en mar del plata,"Villa Madero, Buenos Aires Province, Argentina",casos de coronavirus en santa fe,"Jujuy, Jujuy, Argentina",coronavirus en mendoza hoy,"Loma Hermosa, Buenos Aires Province, Argentina",san luis coronavirus,"Lomas del Mirador, Buenos Aires Province, Argentina",coronavirus jujuy,"Lanús Este, Buenos Aires Province, Argentina",coronavirus cordoba hoy,"Mendoza, Mendoza Province, Argentina",coronavirus casos hoy,"Jujuy, Jujuy, Argentina",brasil,"Lanús Este, Buenos Aires Province, Argentina",vacuna covid,"Lomas del Mirador, Buenos Aires Province, Argentina",muertes coronavirus argentina,"Roldán, Santa Fe Province, Argentina",banco nacion,"Luis Guillon, Buenos Aires Province, Argentina",coronavirus en tucuman,"Luján de Cuyo, Mendoza Province, Argentina",casos coronavirus santa fe,"Libertador General San Martín, Jujuy, Argentina",rosario 3,"Villa Bosch, Buenos Aires Province, Argentina",coronavirus en rio negro,"Pergamino, Buenos Aires Province, Argentina",coronavirus casos hoy,"Pergamino, Buenos Aires Province, Argentina",casos de coronavirus en mendoza,"Lanús Este, Buenos Aires Province, Argentina",casos de coronavirus en misiones,"La Tablada, Buenos Aires Province, Argentina",avifavir,"Burzaco, Buenos Aires Province, Argentina",coronavirus alemania,"Valentín Alsina, Buenos Aires Province, Argentina",coronavirus en peru,"Rafael Calzada, Buenos Aires Province, Argentina",rosario 3,"Malvinas Argentinas, Buenos Aires Province, Argentina",juventus,"Llavallol, Buenos Aires Province, Argentina",casos de coronavirus en salta,"Mar del Plata, Buenos Aires Province, Argentina",coronavirus en córdoba,"San Nicolás de los Arroyos, Buenos Aires Province, Argentina",vacuna para el coronavirus,"Recreo, Santa Fe Province, Argentina",coronavirus casos,"Rosario, Santa Fe Province, Argentina",vacuna argentina,"Godoy Cruz, Mendoza Province, Argentina",coronavirus argentina hoy casos,"Lomas del Mirador, Buenos Aires Province, Argentina",sergio berni coronavirus,"Mendoza, Mendoza Province, Argentina",casos de coronavirus argentina,"Esperanza, Santa Fe Province, Argentina",coronavirus la pampa,"Villa Madero, Buenos Aires Province, Argentina",afip,"Adrogué, Buenos Aires Province, Argentina",como se contagia el coronavirus,"Banfield, Buenos Aires Province, Argentina",casos de coronavirus en santa fe,"Tartagal, Salta Province, Argentina",mapa del coronavirus,"Ramos Mejía, Buenos Aires Province, Argentina",cuantos casos de coronavirus hay en san juan,"Rafaela, Santa Fe Province, Argentina",vacuna covid,"Las Heras, Mendoza Province, Argentina",coronavirus concordia,"Las Heras, Mendoza Province, Argentina",coronavirus en eeuu,"Banfield, Buenos Aires Province, Argentina",coronavirus casos argentina,"Godoy Cruz, Mendoza Province, Argentina",mapa coronavirus,"Yerba Buena, Tucumán, Argentina",parana coronavirus,"Las Vegas, Mendoza Province, Argentina",muertos por coronavirus en argentina,"Luján de Cuyo, Mendoza Province, Argentina",muertos en argentina por coronavirus,"Adrogué, Buenos Aires Province, Argentina",claudia fontan,"Rosario, Santa Fe Province, Argentina",muertos por coronavirus en argentina,"Godoy Cruz, Mendoza Province, Argentina",patricia bullrich,"Piñeiro, Buenos Aires Province, Argentina",coronavirus en mendoza hoy,"Cañada de Gómez, Santa Fe Province, Argentina",paraguay coronavirus,"Banfield, Buenos Aires Province, Argentina",casos de coronavirus hoy en argentina,"Villa Gobernador Galvez, Santa Fe Province, Argentina",fernanda raverta,"San Lorenzo, Santa Fe Province, Argentina",coronavirus en india,"Trenque Lauquen, Buenos Aires Province, Argentina",quiniela,"Santo Tomé, Santa Fe Province, Argentina",rosario 3,"Santa Fe, Santa Fe Province, Argentina",ibuprofeno coronavirus,"Tandil, Buenos Aires Province, Argentina",israel coronavirus,"Piñeiro, Buenos Aires Province, Argentina",coronavirus neuquen
"Gerli, Buenos Aires Province, Argentina",ecuador coronavirus,"Hurlingham, Buenos Aires Province, Argentina",fibrosis quistica,"San Fernando, Buenos Aires Province, Argentina",secuelas del coronavirus,"Rosario, Santa Fe Province, Argentina",casos de coronavirus en cordoba,"Ciudad Jardin Lomas de Palomar, Buenos Aires Province, Argentina",cuantos infectados de coronavirus hay en argentina,"Victoria, Buenos Aires Province, Argentina",infectados en argentina por coronavirus,"Ramos Mejía, Buenos Aires Province, Argentina",bolsonaro coronavirus positivo,"Piñeiro, Buenos Aires Province, Argentina",casos de coronavirus en mar del plata,"Roldán, Santa Fe Province, Argentina",china coronavirus,"Luján de Cuyo, Mendoza Province, Argentina",casos coronavirus hoy,"Tapiales, Buenos Aires Province, Argentina",will smith,"Lomas del Mirador, Buenos Aires Province, Argentina",israel coronavirus,"Villa Madero, Buenos Aires Province, Argentina",reporte diario coronavirus argentina,"Ciudadela, Buenos Aires Province, Argentina",coronavirus en salta hoy,"Villa Centenario, Buenos Aires Province, Argentina",coronavirus en mendoza hoy,"Morón, Buenos Aires Province, Argentina",coronavirus en españa,"Gerli, Buenos Aires Province, Argentina",coronavirus ecuador,"Villa Allende, Cordoba, Argentina",cronica,"Río Tercero, Cordoba, Argentina",salta coronavirus,"Hurlingham, Buenos Aires Province, Argentina",permiso para circular,"Maipú, Mendoza Province, Argentina",casos coronavirus,"Villa Luzuriaga, Buenos Aires Province, Argentina",coronavirus en bolivia,"Maipú, Mendoza Province, Argentina",cuantos casos de coronavirus hay,"San Pedro de Jujuy, Jujuy, Argentina",casos coronavirus en el mundo,"Udaondo, Buenos Aires Province, Argentina",cuantos casos de coronavirus hay en argentina hoy,"Villa Maipú, Buenos Aires Province, Argentina",vacuna oxford,"Las Heras, Mendoza Province, Argentina",aerolineas argentinas,"El Libertador, Buenos Aires Province, Argentina",floppy,"Villa Bosch, Buenos Aires Province, Argentina",el destape,"Castelar, Buenos Aires Province, Argentina",cuantos casos de coronavirus hay en argentina hoy,"Villa Elisa, Buenos Aires Province, Argentina",macri,"Villa Constitución, Santa Fe Province, Argentina",casos coronavirus mendoza,"San Martín, Mendoza Province, Argentina",coronavirus en misiones,"Pergamino, Buenos Aires Province, Argentina",anses ife,"Roldán, Santa Fe Province, Argentina",putin vacuna coronavirus,"Villa Luzuriaga, Buenos Aires Province, Argentina",libano coronavirus,"Morón, Buenos Aires Province, Argentina",ivan de pineda,"Gerli, Buenos Aires Province, Argentina",cura coronavirus,"Funes, Santa Fe Province, Argentina",parana coronavirus,"Santo Tomé, Santa Fe Province, Argentina",river coronavirus,"Morón, Buenos Aires Province, Argentina",rio cuarto coronavirus,"San Lorenzo, Santa Fe Province, Argentina",rusia encontró la vacuna para el coronavirus,"Villa Ballester, Buenos Aires Province, Argentina",muertos por coronavirus,"Llavallol, Buenos Aires Province, Argentina",santiago del estero coronavirus,"San Antonio de Padua, Buenos Aires Province, Argentina",coronavirus en santa fe hoy,"Rosario, Santa Fe Province, Argentina",cuantos casos de coronavirus hay en argentina hoy,"Lomas del Mirador, Buenos Aires Province, Argentina",coronavirus rio cuarto,"Recreo, Santa Fe Province, Argentina",síntomas coronavirus,"Jujuy, Jujuy, Argentina",rafaela noticias,"Wilde, Buenos Aires Province, Argentina",coronavirus en jujuy hoy,"Yerba Buena, Tucumán, Argentina",eduardo feinmann,"Salta, Salta Province, Argentina",cuantos casos de coronavirus hay en san juan,"Puerto Madryn, Chubut Province, Argentina",coronavirus casos,"Mar del Plata, Buenos Aires Province, Argentina",sintomas de covid,"Godoy Cruz, Mendoza Province, Argentina",pareja de famosos con coronavirus,"Maipú, Mendoza Province, Argentina",coronavirus en caba,"Bella Vista, Buenos Aires Province, Argentina",claudio zin,"Villa Lynch, Buenos Aires Province, Argentina",coronavirus en chile,"Necochea, Buenos Aires Province, Argentina",coronavirus argentina casos hoy,"Roldán, Santa Fe Province, Argentina",muertos por coronavirus,"Las Heras, Mendoza Province, Argentina",italia coronavirus hoy,"San Andrés, Buenos Aires Province, Argentina",river coronavirus,"Piñeiro, Buenos Aires Province, Argentina",coronavirus argentina hoy casos,"Lomas de Zamora, Buenos Aires Province, Argentina",esmeralda mitre covid,"Salta, Salta Province, Argentina",coronavirus catamarca,"Firmat, Santa Fe Province, Argentina",el litoral,"Hurlingham, Buenos Aires Province, Argentina",infobae coronavirus,"Haedo, Buenos Aires Province, Argentina",mdz,"Udaondo, Buenos Aires Province, Argentina",gisela marziotta,"Florida, Buenos Aires Province, Argentina",casos de coronavirus hoy en argentina,"Villa Aberastain, San Juan Province, Argentina",vacuna coronavirus argentina,"La Tablada, Buenos Aires Province, Argentina",la voz del interior,"Mar del Plata, Buenos Aires Province, Argentina",procrear,"Villa Madero, Buenos Aires Province, Argentina",la capital
"Muñiz, Buenos Aires Province, Argentina",datos coronavirus argentina,"Udaondo, Buenos Aires Province, Argentina",buquebus coronavirus,"Valentín Alsina, Buenos Aires Province, Argentina",fibrosis quistica,"Villa Martelli, Buenos Aires Province, Argentina",bolivia coronavirus,"Bahía Blanca, Buenos Aires Province, Argentina",casos de coronavirus en rosario,"Tapiales, Buenos Aires Province, Argentina",,"Mendoza, Mendoza Province, Argentina",muertos por coronavirus,"Avellaneda, Buenos Aires Province, Argentina",coronavirus santiago del estero,"Funes, Santa Fe Province, Argentina",santa fe coronavirus,"Tapiales, Buenos Aires Province, Argentina",cura coronavirus,"Adrogué, Buenos Aires Province, Argentina",bill gates,"Villa Madero, Buenos Aires Province, Argentina",coronavirus uruguay,"Jujuy, Jujuy, Argentina",que hacer si tengo sintomas de coronavirus,"Bosques, Buenos Aires Province, Argentina",test de coronavirus,"San José de Metán, Salta Province, Argentina",casos de coronavirus argentina,"Hurlingham, Buenos Aires Province, Argentina",coronavirus colombia,"Adrogué, Buenos Aires Province, Argentina",india coronavirus,"Adrogué, Buenos Aires Province, Argentina",feinmann,"Villa Bosch, Buenos Aires Province, Argentina",casos de coronavirus hoy en argentina,"Villa María, Cordoba, Argentina",haiti,"Lanús Oeste, Buenos Aires Province, Argentina",mercado libre,"Loma Hermosa, Buenos Aires Province, Argentina",mago sin dientes,"Udaondo, Buenos Aires Province, Argentina",coronavirus argentina casos hoy,"Villa Constitución, Santa Fe Province, Argentina",coronavirus ecuador,"Ramos Mejía, Buenos Aires Province, Argentina",coronavirus en mendoza hoy,"Las Heras, Mendoza Province, Argentina",casos de coronavirus en salta,"Bosques, Buenos Aires Province, Argentina",muertos coronavirus,"Tapiales, Buenos Aires Province, Argentina",casos coronavirus hoy argentina,"Ciudad Perico, Jujuy, Argentina",mapa mundial coronavirus,"Jujuy, Jujuy, Argentina",tucuman coronavirus hoy,"Rio Grande, Tierra del Fuego Province, Argentina",chaco coronavirus,"San Martín, Mendoza Province, Argentina",mercado libre argentina,"Mar del Plata, Buenos Aires Province, Argentina",santa fe coronavirus,"La Lonja, Buenos Aires Province, Argentina",san juan coronavirus,"Adrogué, Buenos Aires Province, Argentina",beirut explosion,"Piñeiro, Buenos Aires Province, Argentina",el litoral coronavirus santa fe,"Piñeiro, Buenos Aires Province, Argentina",quini 6,"Villa Gesell, Buenos Aires Province, Argentina",real madrid,"Recreo, Santa Fe Province, Argentina",diego leuco,"Pergamino, Buenos Aires Province, Argentina",estadisticas coronavirus,"Ramos Mejía, Buenos Aires Province, Argentina",santander rio,"Las Vegas, Mendoza Province, Argentina",vacuna rusa coronavirus,"San Antonio de Padua, Buenos Aires Province, Argentina",coronavirus casos hoy,"Banfield, Buenos Aires Province, Argentina",coronavirus gbtnews,"Llavallol, Buenos Aires Province, Argentina",zonas rojas de coronavirus,"Villa Luzuriaga, Buenos Aires Province, Argentina",mercado libre argentina,"Roldán, Santa Fe Province, Argentina",la gaceta,"Rosario, Santa Fe Province, Argentina",17 de agosto,"Malargüe, Mendoza Province, Argentina",bragado coronavirus,"Salta, Salta Province, Argentina",pronostico del tiempo,"Villa Bosch, Buenos Aires Province, Argentina",facundo pastor,"Morón, Buenos Aires Province, Argentina",europa league,"Rosario, Santa Fe Province, Argentina",coronavirus san rafael,"San Rafael, Mendoza Province, Argentina",roxana bruno coronavirus,"Hurlingham, Buenos Aires Province, Argentina",hong kong coronavirus,"Villaguay, Entre Rios, Argentina",claudio zin,"Florida, Buenos Aires Province, Argentina",eduardo feinmann,"Mendoza, Mendoza Province, Argentina",feinmann coronavirus,"Mendoza, Mendoza Province, Argentina",pandemia,"Luján de Cuyo, Mendoza Province, Argentina",alemania coronavirus,"Santa Lucía, San Juan Province, Argentina",covid-19,"Udaondo, Buenos Aires Province, Argentina",dolar blue hoy,"Ramos Mejía, Buenos Aires Province, Argentina",esmeralda mitre,"Hurlingham, Buenos Aires Province, Argentina",coronavirus en santiago del estero,"Llavallol, Buenos Aires Province, Argentina",coronavirus en catamarca,"Orán, Salta Province, Argentina",coronavirus wikipedia,"Adrogué, Buenos Aires Province, Argentina",quiniela,"Tandil, Buenos Aires Province, Argentina",india coronavirus,"Roldán, Santa Fe Province, Argentina",ecuador coronavirus,"Villa Bosch, Buenos Aires Province, Argentina",coronavirus casos hoy,"Llavallol, Buenos Aires Province, Argentina",vacuna covid,"Piñeiro, Buenos Aires Province, Argentina",rio cuarto coronavirus,"Bernal, Buenos Aires Province, Argentina",diana rigg,"Mar del Plata, Buenos Aires Province, Argentina",coronavirus santa fe hoy
"Remedios de Escalada, Buenos Aires Province, Argentina",permiso para circular nuevo coronavirus,"San Pedro de Jujuy, Jujuy, Argentina",priapismo coronavirus,"Longchamps, Buenos Aires Province, Argentina",coronavirus en rio negro,"Funes, Santa Fe Province, Argentina",coronavirus tucuman,"Lomas del Mirador, Buenos Aires Province, Argentina",la capital,"Jujuy, Jujuy, Argentina",,"Villa Lynch, Buenos Aires Province, Argentina",mar del plata coronavirus,"San Andrés, Buenos Aires Province, Argentina",casos coronavirus mendoza,"Florida, Buenos Aires Province, Argentina",pagina 12,"Carapachay, Buenos Aires Province, Argentina",real madrid,"Morón, Buenos Aires Province, Argentina",cuanto dura el coronavirus,"Villa Gobernador Galvez, Santa Fe Province, Argentina",la voz,"Ciudadela, Buenos Aires Province, Argentina",mar del plata coronavirus hoy,"Florida Oeste, Buenos Aires Province, Argentina",temperatura,"Ramos Mejía, Buenos Aires Province, Argentina",reporte diario coronavirus,"Valentín Alsina, Buenos Aires Province, Argentina",coronavirus en italia,"Hurlingham, Buenos Aires Province, Argentina",coronavirus tandil,"Avellaneda, Buenos Aires Province, Argentina",pronostico,"Ciudad Perico, Jujuy, Argentina",coronavirus la plata,"La Tablada, Buenos Aires Province, Argentina",casos de coronavirus en rosario hoy,"Tunuyán, Mendoza Province, Argentina",rosario3,"Banfield, Buenos Aires Province, Argentina",david cufre,"Hurlingham, Buenos Aires Province, Argentina",coronavirus en rio negro,"Munro, Buenos Aires Province, Argentina",tucuman coronavirus,"Banfield, Buenos Aires Province, Argentina",coronavirus argentina hoy casos,"Florida Oeste, Buenos Aires Province, Argentina",noticias,"Valentín Alsina, Buenos Aires Province, Argentina",easy,"Dique Luján, Buenos Aires Province, Argentina",nuevos casos de coronavirus en argentina,"Villa Mercedes, San Luis Province, Argentina",promiedos,"Banfield, Buenos Aires Province, Argentina",sintomas de covid,"Adrogué, Buenos Aires Province, Argentina",alemania coronavirus,"Florida, Buenos Aires Province, Argentina",coronavirus mendoza hoy,"San Miguel de Tucumán, Tucumán, Argentina",la capital,"Mar del Plata, Buenos Aires Province, Argentina",vacuna rusa contra coronavirus,"Morón, Buenos Aires Province, Argentina",coronavirus infobae,"San Andrés, Buenos Aires Province, Argentina",diario panorama,"Banfield, Buenos Aires Province, Argentina",river,"Mar del Plata, Buenos Aires Province, Argentina",viviana canosa coronavirus,"Lanús Este, Buenos Aires Province, Argentina",promiedos,"Hurlingham, Buenos Aires Province, Argentina",ife,"Corrientes, Corrientes Province, Argentina",tandil coronavirus,"Lomas de Zamora, Buenos Aires Province, Argentina",vacuna rusa,"Ciudadela, Buenos Aires Province, Argentina",vacuna coronavirus argentina,"Haedo, Buenos Aires Province, Argentina",brasil,"Río Cuarto, Cordoba, Argentina",annabelle,"Concordia, Entre Rios, Argentina",coronavirus en paraguay,"Recreo, Santa Fe Province, Argentina",coronavirus en misiones,"San Pedro de Jujuy, Jujuy, Argentina",diario rio negro,"Junín, Buenos Aires Province, Argentina",wuhan,"Río Cuarto, Cordoba, Argentina",servicio meteorologico nacional,"Casilda, Santa Fe Province, Argentina",vacuna contra el coronavirus,"El Libertador, Buenos Aires Province, Argentina",casos coronavirus mundo,"Gerli, Buenos Aires Province, Argentina",muertos por coronavirus en el mundo,"Piñeiro, Buenos Aires Province, Argentina",curva coronavirus,"Bernal, Buenos Aires Province, Argentina",coronavirus cipolletti,"Santo Tomé, Santa Fe Province, Argentina",duhalde,"Adrogué, Buenos Aires Province, Argentina",dr zin,"Roldán, Santa Fe Province, Argentina",mar del plata coronavirus,"Piñeiro, Buenos Aires Province, Argentina",baby con coronavirus,"Río Cuarto, Cordoba, Argentina",coronavirus en estados unidos,"Río Cuarto, Cordoba, Argentina",nuevos casos de coronavirus en argentina,"Junín, Buenos Aires Province, Argentina",bragado coronavirus,"Salta, Salta Province, Argentina",coronavirus casos hoy,"Concordia, Entre Rios, Argentina",coronavirus en la plata,"Villaguay, Entre Rios, Argentina",alemania coronavirus,"Llavallol, Buenos Aires Province, Argentina",paola de simone,"Casilda, Santa Fe Province, Argentina",coronavirus casos,"Orán, Salta Province, Argentina",diario los andes,"Villa Gobernador Galvez, Santa Fe Province, Argentina",correo argentino,"Claypole, Buenos Aires Province, Argentina",ranking coronavirus,"Rivadavia, San Juan Province, Argentina",casos coronavirus santa fe,"Ituzaingó, Buenos Aires Province, Argentina",coronavirus argentina infobae,"Mendoza, Mendoza Province, Argentina",riesgo pais,"Tandil, Buenos Aires Province, Argentina",casos de coronavirus en mendoza
"Jujuy, Jujuy, Argentina",real madrid,"Boulogne, Buenos Aires Province, Argentina",cuando cobro,"Castelar, Buenos Aires Province, Argentina",coronavirus parana,"Boulogne, Buenos Aires Province, Argentina",fabian gutierrez,"Villa Lynch, Buenos Aires Province, Argentina",ole,"Villa Lynch, Buenos Aires Province, Argentina",,"Jujuy, Jujuy, Argentina",muertes por coronavirus en argentina,"San Fernando, Buenos Aires Province, Argentina",la falda coronavirus,"Capitán Bermúdez, Santa Fe Province, Argentina",rosario coronavirus,"Hurlingham, Buenos Aires Province, Argentina",diosdado cabello tiene coronavirus,"San Andrés, Buenos Aires Province, Argentina",santafe.gov.ar coronavirus,"Ciudadela, Buenos Aires Province, Argentina",argentina coronavirus hoy,"Cuartel V, Buenos Aires Province, Argentina",nuevos casos coronavirus argentina,"Luján de Cuyo, Mendoza Province, Argentina",cuantos muertos hay por coronavirus,"Villa Luzuriaga, Buenos Aires Province, Argentina",israel coronavirus,"Piñeiro, Buenos Aires Province, Argentina",tn,"Mercedes, Buenos Aires Province, Argentina",messi,"Banfield, Buenos Aires Province, Argentina",coronavirus en rio negro,"Bell Ville, Cordoba, Argentina",oliva coronavirus,"Jujuy, Jujuy, Argentina",el tiempo,"Rosario, Santa Fe Province, Argentina",casos de coronavirus hoy en argentina,"Villa Lynch, Buenos Aires Province, Argentina",casos de coronavirus en santa fe,"Clorinda, Formosa Province, Argentina",nuevos casos de coronavirus,"Adrogué, Buenos Aires Province, Argentina",vacuna covid,"Hurlingham, Buenos Aires Province, Argentina",casos de coronavirus hoy argentina,"Mar del Plata, Buenos Aires Province, Argentina",cura coronavirus,"Florida, Buenos Aires Province, Argentina",cantidad de casos de coronavirus en argentina hoy,"Bella Vista, Buenos Aires Province, Argentina",coronavirus casos argentina,"San Francisco Solano, Buenos Aires Province, Argentina",china suarez,"Pergamino, Buenos Aires Province, Argentina",quini 6,"Las Heras, Mendoza Province, Argentina",nba,"Hurlingham, Buenos Aires Province, Argentina",pronostico,"San Lorenzo, Santa Fe Province, Argentina",corona virus,"Villa Constitución, Santa Fe Province, Argentina",permiso de circulacion,"Haedo, Buenos Aires Province, Argentina",rey juan carlos,"Mar del Plata, Buenos Aires Province, Argentina",el litoral,"Villa Luzuriaga, Buenos Aires Province, Argentina",casos de covid hoy,"Villa Luzuriaga, Buenos Aires Province, Argentina",la voz del interior,"Adrogué, Buenos Aires Province, Argentina",coronavirus usa,"Lomas del Mirador, Buenos Aires Province, Argentina",jorge macri,"Lomas de Zamora, Buenos Aires Province, Argentina",alto alberdi coronavirus,"Tapiales, Buenos Aires Province, Argentina",coronavirus provincia de buenos aires,"Río Cuarto, Cordoba, Argentina",coronavirus rosario hoy,"Lanús Este, Buenos Aires Province, Argentina",laboratorio argentino coronavirus,"Tafí Viejo, Tucumán, Argentina",casos coronavirus mendoza,"Ramos Mejía, Buenos Aires Province, Argentina",rio cuarto coronavirus,"Tigre, Buenos Aires Province, Argentina",uruguay coronavirus,"Malvinas Argentinas, Buenos Aires Province, Argentina",coronavirus catamarca,"Ramos Mejía, Buenos Aires Province, Argentina",banco nacion,"Lanús Oeste, Buenos Aires Province, Argentina",coronavirus en caba,"Necochea, Buenos Aires Province, Argentina",paraguay coronavirus,"Villa Luzuriaga, Buenos Aires Province, Argentina",coronavirus buenos aires,"Funes, Santa Fe Province, Argentina",coronavirus casos hoy,"Florida, Buenos Aires Province, Argentina",como se contagia el coronavirus,"Morón, Buenos Aires Province, Argentina",icardi,"San Andrés, Buenos Aires Province, Argentina",muertos en argentina por coronavirus,"San Andrés, Buenos Aires Province, Argentina",duhalde,"Tandil, Buenos Aires Province, Argentina",casos coronavirus buenos aires argentina,"Hurlingham, Buenos Aires Province, Argentina",noticias,"Chimbas, San Juan Province, Argentina",muertos por coronavirus en el mundo,"Capitán Bermúdez, Santa Fe Province, Argentina",ranking coronavirus,"Villa Bosch, Buenos Aires Province, Argentina",cipolletti coronavirus,"Valentín Alsina, Buenos Aires Province, Argentina",coronavirus en boca juniors,"La Tablada, Buenos Aires Province, Argentina",ed sheeran,"Luis Guillon, Buenos Aires Province, Argentina",diario uno,"Recreo, Santa Fe Province, Argentina",hernan drago,"Lomas del Mirador, Buenos Aires Province, Argentina",coronavirus misiones,"Trenque Lauquen, Buenos Aires Province, Argentina",romina yan,"San Martín, Mendoza Province, Argentina",laje con coronavirus,"El Libertador, Buenos Aires Province, Argentina",casos coronavirus hoy,"Mar del Plata, Buenos Aires Province, Argentina",consejos sobre el coronavirus,"Trenque Lauquen, Buenos Aires Province, Argentina",casos coronavirus cordoba,"San Luis, San Luis Province, Argentina",coronavirus en india,"Casilda, Santa Fe Province, Argentina",tucuman coronavirus
