"Carapachay, Buenos Aires Province, Argentina",,"Rincón de Milberg, Buenos Aires Province, Argentina",,"Berazategui, Buenos Aires Province, Argentina",,"Ezpeleta, Buenos Aires Province, Argentina",coronavirus en mexico,"Adrogué, Buenos Aires Province, Argentina",protocolo coronavirus san luis,"Yerba Buena, Tucumán, Argentina",,"Jose Leon Suarez, Buenos Aires Province, Argentina",la falda coronavirus,"Alta Gracia, Cordoba, Argentina",,"Gonnet, Buenos Aires Province, Argentina",infectados coronavirus,"Ciudadela, Buenos Aires Province, Argentina",,"Vicente López, Buenos Aires Province, Argentina",,"Luján, Buenos Aires Province, Argentina",,"Ezpeleta, Buenos Aires Province, Argentina",,"Wilde, Buenos Aires Province, Argentina",,"Carapachay, Buenos Aires Province, Argentina",,"Vicente López, Buenos Aires Province, Argentina",coronavirus chile hoy,"Rafael Calzada, Buenos Aires Province, Argentina",,"Villa Elisa, Buenos Aires Province, Argentina",,"Vicente López, Buenos Aires Province, Argentina",covid visualizer,"Luján, Buenos Aires Province, Argentina",,"Buenos Aires (Argentina), ZZ-ZZZZ, ZZ",la brujula,"Lomas de Zamora, Buenos Aires Province, Argentina",,"Buenos Aires (Argentina), ZZ-ZZZZ, ZZ",,"Villa de Mayo, Buenos Aires Province, Argentina",,"Villa Gobernador Galvez, Santa Fe Province, Argentina",,"Villa Allende, Cordoba, Argentina",,"Gregorio de Laferrère, Buenos Aires Province, Argentina",,"Maipú, Mendoza Province, Argentina",,"Cañuelas, Buenos Aires Province, Argentina",,"Berazategui, Buenos Aires Province, Argentina",,"Buenos Aires (Argentina), ZZ-ZZZZ, ZZ",,"Munro, Buenos Aires Province, Argentina",,"Ciudad Perico, Jujuy, Argentina",cuantos muertos hay por coronavirus en el mundo,"Banfield, Buenos Aires Province, Argentina",,"Martínez, Buenos Aires Province, Argentina",,"Córdoba, Cordoba, Argentina",,"Avellaneda, Buenos Aires Province, Argentina",,"Ezpeleta, Buenos Aires Province, Argentina",,"Tigre, Buenos Aires Province, Argentina",,"Jose Leon Suarez, Buenos Aires Province, Argentina",,"Monte Chingolo, Buenos Aires Province, Argentina",,"San Fernando, Buenos Aires Province, Argentina",,"Guillermo Hudson, Buenos Aires Province, Argentina",q pasa salta,"Pergamino, Buenos Aires Province, Argentina",,"Villa Domínico, Buenos Aires Province, Argentina",,"Munro, Buenos Aires Province, Argentina",,"San Fernando, Buenos Aires Province, Argentina",roxi tiene coronavirus,"Río Tercero, Cordoba, Argentina",,"Trujui, Buenos Aires Province, Argentina",,"Luján, Buenos Aires Province, Argentina",,"Temperley, Buenos Aires Province, Argentina",,"Dique Luján, Buenos Aires Province, Argentina",,"Villaguay, Entre Rios, Argentina",final champions,"Villa Allende, Cordoba, Argentina",,"Tapiales, Buenos Aires Province, Argentina",,"Villa Lynch, Buenos Aires Province, Argentina",,"Villa Maipú, Buenos Aires Province, Argentina",,"Guillermo Hudson, Buenos Aires Province, Argentina",francia coronavirus,"Temperley, Buenos Aires Province, Argentina",,"Cipolletti, Río Negro, Argentina",salta coronavirus hoy,"Lomas de Zamora, Buenos Aires Province, Argentina",bolsonaro,"Santa Fe, Santa Fe Province, Argentina",,"Luján, Buenos Aires Province, Argentina",coronavirus en mar del plata hoy,"Recreo, Santa Fe Province, Argentina",,"Puerto Madryn, Chubut Province, Argentina",,"Yerba Buena, Tucumán, Argentina",,"Yerba Buena, Tucumán, Argentina",coronavirus en tandil,"Corrientes, Corrientes Province, Argentina",,"Martínez, Buenos Aires Province, Argentina",,"Quilmes, Buenos Aires Province, Argentina",,"Villa Bosch, Buenos Aires Province, Argentina",,"Adrogué, Buenos Aires Province, Argentina",,"Chivilcoy, Buenos Aires Province, Argentina",,"Quilmes, Buenos Aires Province, Argentina",coronavirus en italia hoy
"Chivilcoy, Buenos Aires Province, Argentina",,"Cañuelas, Buenos Aires Province, Argentina",,"Cuartel V, Buenos Aires Province, Argentina",,"Munro, Buenos Aires Province, Argentina",corona virus en argentina,"Villa Luzuriaga, Buenos Aires Province, Argentina",olavarria coronavirus,"Castelar, Buenos Aires Province, Argentina",,"Monte Chingolo, Buenos Aires Province, Argentina",curva de coronavirus en argentina,"La Rioja, La Rioja Province, Argentina",,"Loma Hermosa, Buenos Aires Province, Argentina",coronavirus mar del plata hoy,"Burzaco, Buenos Aires Province, Argentina",,"Garín, Buenos Aires Province, Argentina",,"Martínez, Buenos Aires Province, Argentina",,"Ezeiza, Buenos Aires Province, Argentina",,"Villa Tesei, Buenos Aires Province, Argentina",,"Parana, Entre Rios, Argentina",,"Jose Leon Suarez, Buenos Aires Province, Argentina",coronavirus argentina buenos aires,"Villa Lynch, Buenos Aires Province, Argentina",,"Pablo Nogués, Buenos Aires Province, Argentina",,"Benavidez, Buenos Aires Province, Argentina",f1,"Villa Ballester, Buenos Aires Province, Argentina",,"Boulogne, Buenos Aires Province, Argentina",vacunas coronavirus argentina,"Burzaco, Buenos Aires Province, Argentina",,"Don Torcuato, Buenos Aires Province, Argentina",,"Arrecifes, Buenos Aires Province, Argentina",,"Ituzaingó, Buenos Aires Province, Argentina",,"Boulogne, Buenos Aires Province, Argentina",,"Munro, Buenos Aires Province, Argentina",,"San Fernando, Buenos Aires Province, Argentina",,"Martínez, Buenos Aires Province, Argentina",,"Buenos Aires (Argentina), ZZ-ZZZZ, ZZ",,"Piñeiro, Buenos Aires Province, Argentina",,"San Isidro, Buenos Aires Province, Argentina",,"Lanús Oeste, Buenos Aires Province, Argentina",que pasa salta,"Bragado, Buenos Aires Province, Argentina",,"Luján, Buenos Aires Province, Argentina",,"Rafael Calzada, Buenos Aires Province, Argentina",,"Longchamps, Buenos Aires Province, Argentina",,"Zona de Reserva, Buenos Aires Province, Argentina",,"Rincón de Milberg, Buenos Aires Province, Argentina",,"San Francisco Solano, Buenos Aires Province, Argentina",,"San Justo, Buenos Aires Province, Argentina",,"Guillermo Hudson, Buenos Aires Province, Argentina",,"Ezpeleta, Buenos Aires Province, Argentina",,"Ezeiza, Buenos Aires Province, Argentina",,"Villa Ballester, Buenos Aires Province, Argentina",,"Castelar, Buenos Aires Province, Argentina",,"San Justo, Buenos Aires Province, Argentina",casos de coronavirus argentina hoy,"Villa La Florida, Buenos Aires Province, Argentina",,"Tolosa, Buenos Aires Province, Argentina",,"Ezpeleta, Buenos Aires Province, Argentina",,"Claypole, Buenos Aires Province, Argentina",,"Maipú, Mendoza Province, Argentina",,"Rincón de Milberg, Buenos Aires Province, Argentina",cuanto dura el coronavirus en la ropa,"San Isidro, Buenos Aires Province, Argentina",,"San Antonio de Padua, Buenos Aires Province, Argentina",,"Villa Fiorito, Buenos Aires Province, Argentina",,"Villa de Mayo, Buenos Aires Province, Argentina",,"Vicente López, Buenos Aires Province, Argentina",paraguay coronavirus,"Rincón de Milberg, Buenos Aires Province, Argentina",,"Villa Luzuriaga, Buenos Aires Province, Argentina",el litoral coronavirus,"Gerli, Buenos Aires Province, Argentina",,"Tortuguitas, Buenos Aires Province, Argentina",,"Berazategui, Buenos Aires Province, Argentina",banco provincia,"San Juan, San Juan Province, Argentina",,"Jose Leon Suarez, Buenos Aires Province, Argentina",,"Chivilcoy, Buenos Aires Province, Argentina",,"Temperley, Buenos Aires Province, Argentina",datos coronavirus,"Wilde, Buenos Aires Province, Argentina",,"Guillermo Hudson, Buenos Aires Province, Argentina",,"Martínez, Buenos Aires Province, Argentina",,"Monte Chingolo, Buenos Aires Province, Argentina",,"Chivilcoy, Buenos Aires Province, Argentina",,"Villa Bosch, Buenos Aires Province, Argentina",,"Malvinas Argentinas, Buenos Aires Province, Argentina",coronavirus italia hoy
"Villa Allende, Cordoba, Argentina",,"Monte Chingolo, Buenos Aires Province, Argentina",,"San Isidro, Buenos Aires Province, Argentina",,"Victoria, Buenos Aires Province, Argentina",casos confirmados de coronavirus en argentina,"Llavallol, Buenos Aires Province, Argentina",ultimos casos de coronavirus en argentina,"Bernal, Buenos Aires Province, Argentina",,"Longchamps, Buenos Aires Province, Argentina",eeuu coronavirus hoy,"Lanús Oeste, Buenos Aires Province, Argentina",,"Yerba Buena, Tucumán, Argentina",el destape,"Mercedes, Buenos Aires Province, Argentina",,"Castelar, Buenos Aires Province, Argentina",,"Remedios de Escalada, Buenos Aires Province, Argentina",,"Piñeiro, Buenos Aires Province, Argentina",,"Carapachay, Buenos Aires Province, Argentina",,"Temperley, Buenos Aires Province, Argentina",,"El Palomar, Buenos Aires Province, Argentina",diario el dia,"Ciudadela, Buenos Aires Province, Argentina",,"Don Torcuato, Buenos Aires Province, Argentina",,"San Andrés, Buenos Aires Province, Argentina",primicias ya,"Lanús Este, Buenos Aires Province, Argentina",,"Monte Chingolo, Buenos Aires Province, Argentina",permiso de circulación,"Temperley, Buenos Aires Province, Argentina",,"Del Viso, Buenos Aires Province, Argentina",,"Ciudadela, Buenos Aires Province, Argentina",,"Bella Vista, Buenos Aires Province, Argentina",,"Don Torcuato, Buenos Aires Province, Argentina",,"San Martín, Mendoza Province, Argentina",,"Villa Domínico, Buenos Aires Province, Argentina",,"Benavidez, Buenos Aires Province, Argentina",,"Ituzaingó, Buenos Aires Province, Argentina",,"Lomas de Zamora, Buenos Aires Province, Argentina",,"Ensenada, Buenos Aires Province, Argentina",,"El Libertador, Buenos Aires Province, Argentina",coronavirus hoy mendoza,"Quilmes Oeste, Buenos Aires Province, Argentina",,"San Lorenzo, Santa Fe Province, Argentina",,"Claypole, Buenos Aires Province, Argentina",,"Claypole, Buenos Aires Province, Argentina",,"Santo Tomé, Santa Fe Province, Argentina",,"Haedo, Buenos Aires Province, Argentina",,"Gerli, Buenos Aires Province, Argentina",,"Salta, Salta Province, Argentina",,"Salta, Salta Province, Argentina",,"Monte Chingolo, Buenos Aires Province, Argentina",,"San Carlos de Bariloche, Río Negro, Argentina",,"Berazategui, Buenos Aires Province, Argentina",,"San Fernando, Buenos Aires Province, Argentina",,"Mar del Plata, Buenos Aires Province, Argentina",muertes por coronavirus en el mundo,"San Martín, Mendoza Province, Argentina",,"Villa Ballester, Buenos Aires Province, Argentina",,"San Juan, San Juan Province, Argentina",,"Jujuy, Jujuy, Argentina",,"Berazategui, Buenos Aires Province, Argentina",,"Boulogne, Buenos Aires Province, Argentina",coronavirus estados unidos hoy,"Rafael Calzada, Buenos Aires Province, Argentina",,"Viedma, Río Negro, Argentina",,"Ituzaingó, Buenos Aires Province, Argentina",,"San Isidro, Buenos Aires Province, Argentina",,"San Fernando, Buenos Aires Province, Argentina",muertos coronavirus argentina,"Victoria, Buenos Aires Province, Argentina",,"San Francisco, Cordoba, Argentina",que hacer si tengo sintomas de coronavirus,"Villa Domínico, Buenos Aires Province, Argentina",,"Monte Chingolo, Buenos Aires Province, Argentina",,"Villa de Mayo, Buenos Aires Province, Argentina",cuantos muertos hay por coronavirus,"Tristán Suárez, Buenos Aires Province, Argentina",,"La Tablada, Buenos Aires Province, Argentina",,"Lanús Oeste, Buenos Aires Province, Argentina",,"Claypole, Buenos Aires Province, Argentina",feinmann,"Ciudadela, Buenos Aires Province, Argentina",,"El Libertador, Buenos Aires Province, Argentina",,"Villa Gobernador Galvez, Santa Fe Province, Argentina",,"Yerba Buena, Tucumán, Argentina",,"Villa de Mayo, Buenos Aires Province, Argentina",,"La Lonja, Buenos Aires Province, Argentina",,"Villa Lynch, Buenos Aires Province, Argentina",coronavirus en bahia blanca
"William C. Morris, Buenos Aires Province, Argentina",,"Villa Bosch, Buenos Aires Province, Argentina",,"Balcarce, Buenos Aires Province, Argentina",,"Chivilcoy, Buenos Aires Province, Argentina",san luis coronavirus,"Ciudadela, Buenos Aires Province, Argentina",coronavirus santa cruz,"Bosques, Buenos Aires Province, Argentina",,"San Martín, Mendoza Province, Argentina",banco patagonia,"San Isidro, Buenos Aires Province, Argentina",,"Rafael Calzada, Buenos Aires Province, Argentina",infobae coronavirus hoy,"Gualeguaychú, Entre Rios, Argentina",,"Martínez, Buenos Aires Province, Argentina",,"Las Heras, Mendoza Province, Argentina",,"San Miguel, Buenos Aires Province, Argentina",,"San Justo, Buenos Aires Province, Argentina",,"Munro, Buenos Aires Province, Argentina",,"Ciudad Perico, Jujuy, Argentina",infectados coronavirus argentina hoy,"Bosques, Buenos Aires Province, Argentina",,"Gualeguaychú, Entre Rios, Argentina",,"Jose Leon Suarez, Buenos Aires Province, Argentina",miami coronavirus,"Castelar, Buenos Aires Province, Argentina",,"Benavidez, Buenos Aires Province, Argentina",mapa coronavirus argentina,"Remedios de Escalada, Buenos Aires Province, Argentina",,"Villa Tesei, Buenos Aires Province, Argentina",,"Haedo, Buenos Aires Province, Argentina",,"Claypole, Buenos Aires Province, Argentina",,"El Jagüel, Buenos Aires Province, Argentina",,"Buenos Aires (Argentina), ZZ-ZZZZ, ZZ",,"Zona de Reserva, Buenos Aires Province, Argentina",,"Buenos Aires (Argentina), ZZ-ZZZZ, ZZ",,"Alta Gracia, Cordoba, Argentina",,"Villa Ballester, Buenos Aires Province, Argentina",,"Berazategui, Buenos Aires Province, Argentina",,"Villa Fiorito, Buenos Aires Province, Argentina",bahia blanca coronavirus,"Rio Grande, Tierra del Fuego Province, Argentina",,"Zona de Reserva, Buenos Aires Province, Argentina",,"Bella Vista, Buenos Aires Province, Argentina",,"Remedios de Escalada, Buenos Aires Province, Argentina",,"Bernal Oeste, Buenos Aires Province, Argentina",,"Quilmes, Buenos Aires Province, Argentina",,"Rafael Calzada, Buenos Aires Province, Argentina",,"Alta Gracia, Cordoba, Argentina",,"San Antonio de Padua, Buenos Aires Province, Argentina",,"San Miguel, Buenos Aires Province, Argentina",,"Cañuelas, Buenos Aires Province, Argentina",,"Remedios de Escalada, Buenos Aires Province, Argentina",,"Villa Lynch, Buenos Aires Province, Argentina",,"Rafaela, Santa Fe Province, Argentina",europa league,"Villa Bosch, Buenos Aires Province, Argentina",,"Godoy Cruz, Mendoza Province, Argentina",,"Udaondo, Buenos Aires Province, Argentina",,"Villa Ballester, Buenos Aires Province, Argentina",,"Del Viso, Buenos Aires Province, Argentina",,"Ciudad Perico, Jujuy, Argentina",estadistica coronavirus argentina,"Berazategui, Buenos Aires Province, Argentina",,"General Pacheco, Buenos Aires Province, Argentina",,"Rincón de Milberg, Buenos Aires Province, Argentina",,"Puerto Madryn, Chubut Province, Argentina",,"Puerto Madryn, Chubut Province, Argentina",covid argentina,"Martínez, Buenos Aires Province, Argentina",,"San Andrés, Buenos Aires Province, Argentina",canada coronavirus,"Jujuy, Jujuy, Argentina",,"Lanús Este, Buenos Aires Province, Argentina",,"Viedma, Río Negro, Argentina",us open 2020,"Villa Ballester, Buenos Aires Province, Argentina",,"San Juan, San Juan Province, Argentina",,"Pergamino, Buenos Aires Province, Argentina",,"Ituzaingó, Buenos Aires Province, Argentina",la nueva,"Carapachay, Buenos Aires Province, Argentina",,"Quilmes Oeste, Buenos Aires Province, Argentina",,"Guillermo Hudson, Buenos Aires Province, Argentina",,"Villa Madero, Buenos Aires Province, Argentina",,"San Justo, Buenos Aires Province, Argentina",,"Lanús Este, Buenos Aires Province, Argentina",,"Junín, Buenos Aires Province, Argentina",coronavirus en san rafael
"Monte Chingolo, Buenos Aires Province, Argentina",,"Carapachay, Buenos Aires Province, Argentina",,"San Miguel, Buenos Aires Province, Argentina",,"Pilar Centro, Buenos Aires Province, Argentina",coronavirus reino unido,"San Justo, Buenos Aires Province, Argentina",temperatura actual,"Benavidez, Buenos Aires Province, Argentina",,"Luján, Buenos Aires Province, Argentina",coronavirus cases,"Ezeiza, Buenos Aires Province, Argentina",,"Martínez, Buenos Aires Province, Argentina",mapa mundial del coronavirus,"Ituzaingó, Buenos Aires Province, Argentina",,"El Talar, Buenos Aires Province, Argentina",,"Zona de Reserva, Buenos Aires Province, Argentina",,"Villa Tesei, Buenos Aires Province, Argentina",,"Zona de Reserva, Buenos Aires Province, Argentina",,"Burzaco, Buenos Aires Province, Argentina",,"Luján, Buenos Aires Province, Argentina",test rapido coronavirus,"Los Troncos del Talar, Buenos Aires Province, Argentina",,"Lomas de Zamora, Buenos Aires Province, Argentina",,"Villa María, Cordoba, Argentina",coronavirus en india,"Villa Fiorito, Buenos Aires Province, Argentina",,"Villa de Mayo, Buenos Aires Province, Argentina",reporte diario coronavirus,"Victoria, Buenos Aires Province, Argentina",,"Luján, Buenos Aires Province, Argentina",,"Quilmes, Buenos Aires Province, Argentina",,"San Miguel, Buenos Aires Province, Argentina",,"Claypole, Buenos Aires Province, Argentina",,"Villa Tesei, Buenos Aires Province, Argentina",,"Ituzaingó, Buenos Aires Province, Argentina",,"Adrogué, Buenos Aires Province, Argentina",,"Quilmes Oeste, Buenos Aires Province, Argentina",,"Gerli, Buenos Aires Province, Argentina",,"Luján, Buenos Aires Province, Argentina",,"Quilmes, Buenos Aires Province, Argentina",148 coronavirus,"Ituzaingó, Buenos Aires Province, Argentina",,"Mendoza, Mendoza Province, Argentina",,"Dique Luján, Buenos Aires Province, Argentina",,"San Lorenzo, Santa Fe Province, Argentina",,"Recreo, Santa Fe Province, Argentina",,"Villa Carlos Paz, Cordoba, Argentina",,"Berazategui, Buenos Aires Province, Argentina",,"Ezpeleta, Buenos Aires Province, Argentina",,"Yerba Buena, Tucumán, Argentina",,"San Isidro, Buenos Aires Province, Argentina",,"San Justo, Buenos Aires Province, Argentina",,"Tandil, Buenos Aires Province, Argentina",,"Luján, Buenos Aires Province, Argentina",,"Villa Ballester, Buenos Aires Province, Argentina",coronavirus argentina cordoba,"Martínez, Buenos Aires Province, Argentina",,"Maipú, Mendoza Province, Argentina",,"Castelar, Buenos Aires Province, Argentina",,"Vicente López, Buenos Aires Province, Argentina",,"Gerli, Buenos Aires Province, Argentina",,"Temperley, Buenos Aires Province, Argentina",coronavirus bahía blanca,"Villa Elisa, Buenos Aires Province, Argentina",,"Quilmes Oeste, Buenos Aires Province, Argentina",,"Berazategui, Buenos Aires Province, Argentina",,"Lanús Oeste, Buenos Aires Province, Argentina",,"Zona de Reserva, Buenos Aires Province, Argentina",curva coronavirus,"Luján, Buenos Aires Province, Argentina",,"Udaondo, Buenos Aires Province, Argentina",coronavirus en el mundo estadisticas,"Corrientes, Corrientes Province, Argentina",,"Berazategui, Buenos Aires Province, Argentina",,"Villa Gobernador Galvez, Santa Fe Province, Argentina",coronavirus en la argentina,"Gonnet, Buenos Aires Province, Argentina",,"Zona de Reserva, Buenos Aires Province, Argentina",,"Villa Bosch, Buenos Aires Province, Argentina",,"Avellaneda, Buenos Aires Province, Argentina",venado tuerto coronavirus,"San Carlos de Bolívar, Buenos Aires Province, Argentina",,"Chivilcoy, Buenos Aires Province, Argentina",,"Munro, Buenos Aires Province, Argentina",,"San Rafael, Mendoza Province, Argentina",,"Gerli, Buenos Aires Province, Argentina",,"Remedios de Escalada, Buenos Aires Province, Argentina",,"Berazategui, Buenos Aires Province, Argentina",mialgia
"Mar del Plata, Buenos Aires Province, Argentina",,"Dique Luján, Buenos Aires Province, Argentina",,"Presidente Derqui, Buenos Aires Province, Argentina",,"Villa Domínico, Buenos Aires Province, Argentina",infobae coronavirus hoy,"Paso del Rey, Buenos Aires Province, Argentina",casos coronavirus españa,"San Luis, San Luis Province, Argentina",,"Villa Domínico, Buenos Aires Province, Argentina",el presidente de brasil tiene coronavirus,"Marcos Paz, Buenos Aires Province, Argentina",,"Junín, Buenos Aires Province, Argentina",cantidad de casos de coronavirus en argentina,"Loma Hermosa, Buenos Aires Province, Argentina",,"Quilmes, Buenos Aires Province, Argentina",,"Ituzaingó, Buenos Aires Province, Argentina",,"Remedios de Escalada, Buenos Aires Province, Argentina",,"Quilmes, Buenos Aires Province, Argentina",,"Ciudadela, Buenos Aires Province, Argentina",,"Córdoba, Cordoba, Argentina",aerolineas argentinas,"San Justo, Buenos Aires Province, Argentina",,"Villa Gobernador Galvez, Santa Fe Province, Argentina",,"Burzaco, Buenos Aires Province, Argentina",coronavirus ayer en argentina,"Jose Leon Suarez, Buenos Aires Province, Argentina",,"Villa Allende, Cordoba, Argentina",juventus,"Gonnet, Buenos Aires Province, Argentina",,"Quilmes, Buenos Aires Province, Argentina",,"Lanús Oeste, Buenos Aires Province, Argentina",,"Luján, Buenos Aires Province, Argentina",,"Jose Leon Suarez, Buenos Aires Province, Argentina",,"El Palomar, Buenos Aires Province, Argentina",,"San Luis, San Luis Province, Argentina",,"Gerli, Buenos Aires Province, Argentina",,"Villa Mercedes, San Luis Province, Argentina",,"Villa Centenario, Buenos Aires Province, Argentina",,"San Antonio de Padua, Buenos Aires Province, Argentina",,"Quilmes Oeste, Buenos Aires Province, Argentina",coco sily coronavirus,"Boulogne, Buenos Aires Province, Argentina",,"Chascomús, Buenos Aires Province, Argentina",,"Berazategui, Buenos Aires Province, Argentina",,"Brandsen, Buenos Aires Province, Argentina",,"General Pacheco, Buenos Aires Province, Argentina",,"Ituzaingó, Buenos Aires Province, Argentina",,"City Bell, Buenos Aires Province, Argentina",,"Yerba Buena, Tucumán, Argentina",,"Ciudadela, Buenos Aires Province, Argentina",,"William C. Morris, Buenos Aires Province, Argentina",,"Palpala, Jujuy, Argentina",,"Manuel Alberti, Buenos Aires Province, Argentina",,"Rincón de Milberg, Buenos Aires Province, Argentina",,"Alta Gracia, Cordoba, Argentina",facundo astudillo,"Castelar, Buenos Aires Province, Argentina",,"Bernal, Buenos Aires Province, Argentina",,"Martínez, Buenos Aires Province, Argentina",,"Castelar, Buenos Aires Province, Argentina",,"Villa Carlos Paz, Cordoba, Argentina",,"Río Cuarto, Cordoba, Argentina",concordia coronavirus,"San Lorenzo, Santa Fe Province, Argentina",,"Lanús Oeste, Buenos Aires Province, Argentina",,"San Fernando, Buenos Aires Province, Argentina",,"Villa Tesei, Buenos Aires Province, Argentina",,"Dique Luján, Buenos Aires Province, Argentina",coronavirus bariloche,"Castelar, Buenos Aires Province, Argentina",,"Del Viso, Buenos Aires Province, Argentina",liam payne,"Boulogne, Buenos Aires Province, Argentina",,"San Justo, Buenos Aires Province, Argentina",,"San Justo, Buenos Aires Province, Argentina",facundo astudillo castro,"Don Torcuato, Buenos Aires Province, Argentina",,"Vicente López, Buenos Aires Province, Argentina",,"Unquillo, Cordoba, Argentina",,"Villa Maipú, Buenos Aires Province, Argentina",cuantos muertos hay por coronavirus en el mundo,"Vicente López, Buenos Aires Province, Argentina",,"Jujuy, Jujuy, Argentina",,"El Palomar, Buenos Aires Province, Argentina",,"Villa Mercedes, San Luis Province, Argentina",,"San Miguel de Tucumán, Tucumán, Argentina",,"Rincón de Milberg, Buenos Aires Province, Argentina",,"Llavallol, Buenos Aires Province, Argentina",mapa coronavirus mundial
