AR,AR.1,AR.2,AR.3,AR.4,AR.5,AR.6,AR.7,AR.8,AR.9,AR.10,AR.11,AR.12,AR.13,AR.14,AR.15,AR.16,AR.17,AR.18,AR.19,AR.20,AR.21,AR.22,AR.23,AR.24,AR.25,AR.26,AR.27,AR.28,AR.29,AR.30,AR.31,AR.32,AR.33,AR.34,AR.35,AR.36,AR.37,AR.38,AR.39,AR.40,AR.41,AR.42,AR.43,AR.44,AR.45,AR.46,AR.47,AR.48,AR.49,AR.50,AR.51,AR.52,AR.53,AR.54,AR.55,AR.56,AR.57,AR.58,AR.59,AR.60,AR.61,AR.62,AR.63,AR.64,AR.65,AR.66,AR.67,AR.68,AR.69,AR.70,AR.71,AR.72,AR.73,AR.74,AR.75,AR.76,AR.77,AR.78,AR.79,AR.80,AR.81,AR.82,AR.83,AR.84,AR.85,AR.86,AR.87,AR.88,AR.89,AR.90,AR.91,AR.92,AR.93,AR.94,AR.95,AR.96,AR.97,AR.98,AR.99,AR.100,AR.101,AR.102,AR.103,AR.104,AR.105,AR.106,AR.107,AR.108,AR.109,AR.110,AR.111,AR.112,AR.113,AR.114,AR.115,AR.116,AR.117,AR.118,AR.119,AR.120,AR.121,AR.122,AR.123,AR.124,AR.125,AR.126,AR.127,AR.128,AR.129,AR.130,AR.131,AR.132,AR.133,AR.134,AR.135,AR.136,AR.137,AR.138,AR.139,AR.140,AR.141,AR.142,AR.143,AR.144,AR.145,AR.146,AR.147
2020-07-01  City,2020-07-01  Trending,2020-07-02  City,2020-07-02  Trending,2020-07-03  City,2020-07-03  Trending,2020-07-04  City,2020-07-04  Trending,2020-07-05  City,2020-07-05  Trending,2020-07-06  City,2020-07-06  Trending,2020-07-07  City,2020-07-07  Trending,2020-07-08  City,2020-07-08  Trending,2020-07-09  City,2020-07-09  Trending,2020-07-10  City,2020-07-10  Trending,2020-07-11  City,2020-07-11  Trending,2020-07-12  City,2020-07-12  Trending,2020-07-13  City,2020-07-13  Trending,2020-07-14  City,2020-07-14  Trending,2020-07-15  City,2020-07-15  Trending,2020-07-16  City,2020-07-16  Trending,2020-07-17  City,2020-07-17  Trending,2020-07-18  City,2020-07-18  Trending,2020-07-19  City,2020-07-19  Trending,2020-07-20  City,2020-07-20  Trending,2020-07-21  City,2020-07-21  Trending,2020-07-22  City,2020-07-22  Trending,2020-07-23  City,2020-07-23  Trending,2020-07-24  City,2020-07-24  Trending,2020-07-25  City,2020-07-25  Trending,2020-07-26  City,2020-07-26  Trending,2020-07-27  City,2020-07-27  Trending,2020-07-28  City,2020-07-28  Trending,2020-07-29  City,2020-07-29  Trending,2020-07-30  City,2020-07-30  Trending,2020-07-31  City,2020-07-31  Trending,2020-08-01  City,2020-08-01  Trending,2020-08-02  City,2020-08-02  Trending,2020-08-03  City,2020-08-03  Trending,2020-08-04  City,2020-08-04  Trending,2020-08-05  City,2020-08-05  Trending,2020-08-06  City,2020-08-06  Trending,2020-08-07  City,2020-08-07  Trending,2020-08-08  City,2020-08-08  Trending,2020-08-09  City,2020-08-09  Trending,2020-08-10  City,2020-08-10  Trending,2020-08-11  City,2020-08-11  Trending,2020-08-12  City,2020-08-12  Trending,2020-08-13  City,2020-08-13  Trending,2020-08-14  City,2020-08-14  Trending,2020-08-15  City,2020-08-15  Trending,2020-08-16  City,2020-08-16  Trending,2020-08-17  City,2020-08-17  Trending,2020-08-18  City,2020-08-18  Trending,2020-08-19  City,2020-08-19  Trending,2020-08-20  City,2020-08-20  Trending,2020-08-21  City,2020-08-21  Trending,2020-08-22  City,2020-08-22  Trending,2020-08-23  City,2020-08-23  Trending,2020-08-24  City,2020-08-24  Trending,2020-08-25  City,2020-08-25  Trending,2020-08-26  City,2020-08-26  Trending,2020-08-27  City,2020-08-27  Trending,2020-08-28  City,2020-08-28  Trending,2020-08-29  City,2020-08-29  Trending,2020-08-30  City,2020-08-30  Trending,2020-08-31  City,2020-08-31  Trending,2020-09-01  City,2020-09-01  Trending,2020-09-02  City,2020-09-02  Trending,2020-09-03  City,2020-09-03  Trending,2020-09-04  City,2020-09-04  Trending,2020-09-05  City,2020-09-05  Trending,2020-09-06  City,2020-09-06  Trending,2020-09-07  City,2020-09-07  Trending,2020-09-08  City,2020-09-08  Trending,2020-09-09  City,2020-09-09  Trending,2020-09-10  City,2020-09-10  Trending,2020-09-11  City,2020-09-11  Trending,2020-09-12  City,2020-09-12  Trending
"Libertador General San Martín, Jujuy, Argentina",coronavirus hoy,"Libertador General San Martín, Jujuy, Argentina",sintomas de coronavirus,"Catamarca, Catamarca Province, Argentina",sintomas coronavirus,"San Isidro, Catamarca Province, Argentina",casos de coronavirus en argentina,"Tilisarao, San Luis Province, Argentina",san luis coronavirus,"Villa Constitución, Santa Fe Province, Argentina",mendoza coronavirus,"Villa Constitución, Santa Fe Province, Argentina",bolsonaro coronavirus,"Catamarca, Catamarca Province, Argentina",coronavirus mendoza,"San Isidro, Catamarca Province, Argentina",casos de coronavirus en argentina,"Granadero Baigorria, Santa Fe Province, Argentina",vacuna coronavirus,"Mar del Plata, Buenos Aires Province, Argentina",vacuna coronavirus,"Marcos Juárez, Cordoba, Argentina",sintomas de coronavirus,"Marcos Juárez, Cordoba, Argentina",cordoba coronavirus,"Marcos Juárez, Cordoba, Argentina",sintomas coronavirus,"Luján de Cuyo, Mendoza Province, Argentina",coronavirus hoy,"Oliva, Cordoba, Argentina",coronavirus en argentina,"Oncativo, Cordoba, Argentina",jujuy coronavirus,"Oliva, Cordoba, Argentina",coronavirus mendoza,"Río Cuarto, Cordoba, Argentina",coronavirus hoy,"Las Heras, Mendoza Province, Argentina",vacuna coronavirus,"Oncativo, Cordoba, Argentina",coronavirus argentina,"Oncativo, Cordoba, Argentina",coronavirus santa fe,"Funes, Santa Fe Province, Argentina",coronavirus rosario,"Río Tercero, Cordoba, Argentina",coronavirus la pampa,"Río Tercero, Cordoba, Argentina",casos de coronavirus en argentina hoy,"Maipú, Mendoza Province, Argentina",sintomas de coronavirus,"Paso de los Libres, Corrientes Province, Argentina",hot sale,"Libertador General San Martín, Jujuy, Argentina",coronavirus en argentina,"Paso de los Libres, Corrientes Province, Argentina",coronavirus tucumán,"Casilda, Santa Fe Province, Argentina",casos coronavirus argentina hoy,"Toay, La Pampa Province, Argentina",casos de coronavirus en el mundo,"Toay, La Pampa Province, Argentina",coronavirus mendoza,"Pinamar, Buenos Aires Province, Argentina",coronavirus rosario,"Casilda, Santa Fe Province, Argentina",anses,"Casilda, Santa Fe Province, Argentina",vacuna rusa para coronavirus,"Casilda, Santa Fe Province, Argentina",coronavirus santa fe,"Casilda, Santa Fe Province, Argentina",casos coronavirus argentina hoy,"Viedma, Río Negro, Argentina",cuantos casos de coronavirus hay en argentina hoy,"Viedma, Río Negro, Argentina",jujuy coronavirus,"Viedma, Río Negro, Argentina",fantino tiene coronavirus,"Tartagal, Salta Province, Argentina",jujuy coronavirus,"Tartagal, Salta Province, Argentina",vacuna coronavirus,"Tartagal, Salta Province, Argentina",coronavirus hoy,"Hurlingham, Buenos Aires Province, Argentina",coronavirus tucuman,"Esperanza, Santa Fe Province, Argentina",españa coronavirus,"Los Toldos, Buenos Aires Province, Argentina",coronavirus salta,"Río Cuarto, Cordoba, Argentina",coronavirus hoy,"Río Cuarto, Cordoba, Argentina",coronavirus mendoza,"Rafaela, Santa Fe Province, Argentina",ife,"Rafaela, Santa Fe Province, Argentina",julius lothar meyer,"Villa Aberastain, San Juan Province, Argentina",coronavirus san juan,"Tandil, Buenos Aires Province, Argentina",casos de coronavirus hoy,"Santa Lucía, San Juan Province, Argentina",coronavirus en argentina,"Santa Lucía, San Juan Province, Argentina",coronavirus en rosario,"Villa Aberastain, San Juan Province, Argentina",belu lucius coronavirus,"Villa Aberastain, San Juan Province, Argentina",barbara hepworth,"Villa Aberastain, San Juan Province, Argentina",coronavirus hoy argentina,"Villa Constitución, Santa Fe Province, Argentina",coronavirus cordoba,"Tilisarao, San Luis Province, Argentina",baby etchecopar tiene coronavirus,"San Luis, San Luis Province, Argentina",sintomas del coronavirus,"Tilisarao, San Luis Province, Argentina",casos de coronavirus en argentina,"Tilisarao, San Luis Province, Argentina",boca coronavirus,"San Luis, San Luis Province, Argentina",coronavirus hoy,"Villa Constitución, Santa Fe Province, Argentina",tiempo de mañana,"Godoy Cruz, Mendoza Province, Argentina",coronavirus mendoza,"Funes, Santa Fe Province, Argentina",coronavirus rosario,"Villa Constitución, Santa Fe Province, Argentina",coronavirus argentina,"Godoy Cruz, Mendoza Province, Argentina",casos de coronavirus hoy,"Rosario de Lerma, Salta Province, Argentina",salta coronavirus,"Maipú, Mendoza Province, Argentina",coronavirus hoy,"Granadero Baigorria, Santa Fe Province, Argentina",vacuna coronavirus,"Esquel, Chubut Province, Argentina",coronavirus en argentina hoy,"Rosario de Lerma, Salta Province, Argentina",coronavirus santa fe,"Villa Constitución, Santa Fe Province, Argentina",coronavirus rosario
"Tapiales, Buenos Aires Province, Argentina",casos coronavirus argentina,"Tapiales, Buenos Aires Province, Argentina",belen francese coronavirus,"Libertador General San Martín, Jujuy, Argentina",coronavirus rosario,"Catamarca, Catamarca Province, Argentina",sintomas de coronavirus,"Villa Mercedes, San Luis Province, Argentina",coronavirus rosario,"General Güemes, Salta Province, Argentina",que es el coronavirus,"Mercedes, Buenos Aires Province, Argentina",sintomas coronavirus,"San Isidro, Catamarca Province, Argentina",artemisia gentileschi,"Catamarca, Catamarca Province, Argentina",coronavirus hoy,"Mar del Plata, Buenos Aires Province, Argentina",coronavirus mar del plata,"San Lorenzo, Santa Fe Province, Argentina",casos de coronavirus,"Libertador General San Martín, Jujuy, Argentina",coronavirus rosario,"Mar del Plata, Buenos Aires Province, Argentina",marcos juarez coronavirus,"Capitán Bermúdez, Santa Fe Province, Argentina",naya rivera,"Maipú, Mendoza Province, Argentina",coronavirus mendoza,"Maipú, Mendoza Province, Argentina",coronavirus hoy,"Libertador General San Martín, Jujuy, Argentina",cuarentena argentina,"San José de Metán, Salta Province, Argentina",coronavirus santa fe,"Maipú, Mendoza Province, Argentina",coronavirus mendoza,"Maipú, Mendoza Province, Argentina",dilhan eryurt,"Valentín Alsina, Buenos Aires Province, Argentina",coronavirus en argentina,"Casilda, Santa Fe Province, Argentina",coronavirus en cordoba,"Rosario, Santa Fe Province, Argentina",coronavirus hoy en argentina,"Trenque Lauquen, Buenos Aires Province, Argentina",dolar blue,"Casilda, Santa Fe Province, Argentina",coronavirus hoy en argentina,"Godoy Cruz, Mendoza Province, Argentina",coronavirus la pampa,"Trenque Lauquen, Buenos Aires Province, Argentina",jeanne baret,"Santa Rosa, La Pampa Province, Argentina",coronavirus argentina hoy,"Casilda, Santa Fe Province, Argentina",coronavirus en tucuman,"Tafí Viejo, Tucumán, Argentina",coronavirus en tucumán,"Casilda, Santa Fe Province, Argentina",mendoza coronavirus,"Casilda, Santa Fe Province, Argentina",caña con ruda coronavirus,"Tafí Viejo, Tucumán, Argentina",coronavirus cordoba,"Tafí Viejo, Tucumán, Argentina",nicole neumann coronavirus,"Tafí Viejo, Tucumán, Argentina",nicole neumann coronavirus,"Funes, Santa Fe Province, Argentina",prevención covid-19,"Pergamino, Buenos Aires Province, Argentina",casos de coronavirus hoy,"Pinamar, Buenos Aires Province, Argentina",coronavirus argentina casos,"Carmen de Patagones, Buenos Aires Province, Argentina",coronavirus jujuy,"Carmen de Patagones, Buenos Aires Province, Argentina",vacuna coronavirus,"Villa Madero, Buenos Aires Province, Argentina",coronavirus en corrientes,"Granadero Baigorria, Santa Fe Province, Argentina",rusia coronavirus,"Libertador General San Martín, Jujuy, Argentina",coronavirus argentina hoy,"Santa Fe, Santa Fe Province, Argentina",coronavirus tucumán,"San Rafael, Mendoza Province, Argentina",rosario coronavirus,"San Rafael, Mendoza Province, Argentina",barcelona,"Esperanza, Santa Fe Province, Argentina",infobae,"Tartagal, Salta Province, Argentina",facundo castro,"Los Toldos, Buenos Aires Province, Argentina",marcha 17a,"Villa Constitución, Santa Fe Province, Argentina",casos coronavirus hoy,"San Juan, San Juan Province, Argentina",feinmann coronavirus,"Santa Lucía, San Juan Province, Argentina",casos coronavirus,"Chimbas, San Juan Province, Argentina",casos de coronavirus en argentina,"Chimbas, San Juan Province, Argentina",coronavirus rosario hoy,"Chimbas, San Juan Province, Argentina",que es el coronavirus,"Santa Lucía, San Juan Province, Argentina",feinmann coronavirus,"Orán, Salta Province, Argentina",messi,"Mar del Plata, Buenos Aires Province, Argentina",casos de coronavirus,"Villa Constitución, Santa Fe Province, Argentina",feinmann coronavirus,"Villa Constitución, Santa Fe Province, Argentina",coronavirus rosario,"La Punta, San Luis Province, Argentina",sintomas coronavirus,"San Luis, San Luis Province, Argentina",lanata,"Villa Constitución, Santa Fe Province, Argentina",casos coronavirus argentina,"Funes, Santa Fe Province, Argentina",santa fe coronavirus,"Catamarca, Catamarca Province, Argentina",coronavirus en mendoza,"Ibarlucea, Santa Fe Province, Argentina",coronavirus santa fe,"Funes, Santa Fe Province, Argentina",coronavirus en argentina,"Maipú, Mendoza Province, Argentina",coronavirus en mendoza,"Las Vegas, Mendoza Province, Argentina",tandil coronavirus,"Las Heras, Mendoza Province, Argentina",casos coronavirus argentina,"Villa Constitución, Santa Fe Province, Argentina",coronavirus santa fe,"San Luis, San Luis Province, Argentina",coronavirus hoy en argentina,"Santa Fe, Santa Fe Province, Argentina",santa fe coronavirus,"San José de Metán, Salta Province, Argentina",sintomas de coronavirus
"Tartagal, Salta Province, Argentina",casos de coronavirus en argentina hoy,"Ciudad Perico, Jujuy, Argentina",mendoza coronavirus,"Dolores, Buenos Aires Province, Argentina",catamarca coronavirus,"San Lorenzo, Salta Province, Argentina",catamarca coronavirus,"San Luis, San Luis Province, Argentina",sintomas coronavirus,"Catamarca, Catamarca Province, Argentina",nick cordero,"Salta, Salta Province, Argentina",coronavirus brasil,"Luján de Cuyo, Mendoza Province, Argentina",coronavirus mar del plata,"Villa Constitución, Santa Fe Province, Argentina",coronavirus rosario,"San Lorenzo, Santa Fe Province, Argentina",mar del plata coronavirus,"Marcos Juárez, Cordoba, Argentina",casos coronavirus argentina hoy,"Mar del Plata, Buenos Aires Province, Argentina",coronavirus santa fe,"Granadero Baigorria, Santa Fe Province, Argentina",karol g tiene coronavirus,"Mar del Plata, Buenos Aires Province, Argentina",karol g tiene coronavirus,"Santa Rosa, La Pampa Province, Argentina",coronavirus en mendoza,"Godoy Cruz, Mendoza Province, Argentina",casos de coronavirus,"Mar del Plata, Buenos Aires Province, Argentina",cuarentena,"Godoy Cruz, Mendoza Province, Argentina",coronavirus españa,"Las Vegas, Mendoza Province, Argentina",casos de coronavirus en argentina,"Las Vegas, Mendoza Province, Argentina",casos de coronavirus en cordoba,"Villa Madero, Buenos Aires Province, Argentina",coronavirus hoy,"Libertador General San Martín, Jujuy, Argentina",coronavirus italia,"Granadero Baigorria, Santa Fe Province, Argentina",casos de coronavirus en argentina hoy,"Libertador General San Martín, Jujuy, Argentina",coronavirus en misiones,"Villa Lynch, Buenos Aires Province, Argentina",casos coronavirus hoy,"Granadero Baigorria, Santa Fe Province, Argentina",mendoza coronavirus,"Cañada de Gómez, Santa Fe Province, Argentina",casos coronavirus buenos aires argentina,"Villa Madero, Buenos Aires Province, Argentina",la floppy tiene coronavirus,"Libertador General San Martín, Jujuy, Argentina",casos de coronavirus en el mundo,"Yerba Buena, Tucumán, Argentina",casos coronavirus hoy,"Yerba Buena, Tucumán, Argentina",coronavirus francia,"Santa Rosa, La Pampa Province, Argentina",casos coronavirus argentina hoy,"Casilda, Santa Fe Province, Argentina",casos coronavirus argentina hoy,"Concepción, Tucumán, Argentina",coronavirus misiones,"San Carlos de Bariloche, Río Negro, Argentina",beirut,"Recreo, Santa Fe Province, Argentina",beirut,"Concepción, Tucumán, Argentina",coronavirus en santa fe,"Frías, Santiago del Estero Province, Argentina",cristina,"Tartagal, Salta Province, Argentina",infobae coronavirus argentina hoy,"Pinamar, Buenos Aires Province, Argentina",coronavirus salta,"Villa Constitución, Santa Fe Province, Argentina",jujuy coronavirus hoy,"Casilda, Santa Fe Province, Argentina",vacuna coronavirus rusia,"Granadero Baigorria, Santa Fe Province, Argentina",infobae,"Tartagal, Salta Province, Argentina",vacuna coronavirus argentina,"Tartagal, Salta Province, Argentina",mendoza coronavirus,"Tartagal, Salta Province, Argentina",berni tiene coronavirus,"San Rafael, Mendoza Province, Argentina",casos coronavirus argentina,"Firmat, Santa Fe Province, Argentina",coronavirus en mendoza hoy,"San Rafael, Mendoza Province, Argentina",champions,"San Rafael, Mendoza Province, Argentina",casos coronavirus,"Santa Lucía, San Juan Province, Argentina",feinmann tiene coronavirus,"Chimbas, San Juan Province, Argentina",italia coronavirus,"Villa Aberastain, San Juan Province, Argentina",coronavirus mendoza,"Villa Aberastain, San Juan Province, Argentina",muertos por coronavirus,"Villa Krause, San Juan Province, Argentina",quini 6,"Chimbas, San Juan Province, Argentina",messi,"Santa Lucía, San Juan Province, Argentina",coronavirus hoy en argentina,"San Luis, San Luis Province, Argentina",coronavirus en el mundo,"San Luis, San Luis Province, Argentina",baby etchecopar,"Funes, Santa Fe Province, Argentina",coronavirus santa fe,"San Luis, San Luis Province, Argentina",coronavirus san luis,"Villa Mercedes, San Luis Province, Argentina",italia coronavirus hoy,"Godoy Cruz, Mendoza Province, Argentina",casos de coronavirus hoy,"Granadero Baigorria, Santa Fe Province, Argentina",rosario3,"Maipú, Mendoza Province, Argentina",coronavirus hoy en argentina,"Granadero Baigorria, Santa Fe Province, Argentina",sintomas de coronavirus,"Rosario, Santa Fe Province, Argentina",coronavirus hoy,"Mendoza, Mendoza Province, Argentina",mendoza coronavirus,"Maipú, Mendoza Province, Argentina",antonio laje coronavirus,"Las Vegas, Mendoza Province, Argentina",casos de coronavirus en argentina,"Sunchales, Santa Fe Province, Argentina",coronavirus vacuna,"Granadero Baigorria, Santa Fe Province, Argentina",coronavirus san luis,"Villa Constitución, Santa Fe Province, Argentina",día del maestro,"Santa Fe, Santa Fe Province, Argentina",santa fe coronavirus
"Hurlingham, Buenos Aires Province, Argentina",coronavirus hoy en argentina,"Palpala, Jujuy, Argentina",casos coronavirus buenos aires argentina,"Ciudad Perico, Jujuy, Argentina",coronavirus en mendoza,"General Güemes, Salta Province, Argentina",coronavirus en el mundo,"Catamarca, Catamarca Province, Argentina",casos de coronavirus en argentina hoy,"Rosario de Lerma, Salta Province, Argentina",bake off,"Florida, Buenos Aires Province, Argentina",bolsonaro positivo coronavirus,"Las Vegas, Mendoza Province, Argentina",coronavirus salta,"San Lorenzo, Santa Fe Province, Argentina",coronavirus mar del plata,"Libertador General San Martín, Jujuy, Argentina",coronavirus en mar del plata,"Victoria, Entre Rios, Argentina",vacuna coronavirus argentina,"Rosario, Santa Fe Province, Argentina",coronavirus hoy en argentina,"Funes, Santa Fe Province, Argentina",paraguay coronavirus,"Salta, Salta Province, Argentina",andy kusnetzoff coronavirus,"Las Vegas, Mendoza Province, Argentina",casos de coronavirus,"Marcos Juárez, Cordoba, Argentina",casos de coronavirus hoy,"Funes, Santa Fe Province, Argentina",alberto fernandez,"Libertador General San Martín, Jujuy, Argentina",coronavirus en mendoza,"Rio Gallegos, Santa Cruz Province, Argentina",casos coronavirus argentina,"Godoy Cruz, Mendoza Province, Argentina",vacuna coronavirus oxford,"San Antonio de Padua, Buenos Aires Province, Argentina",casos de coronavirus en argentina,"Maipú, Mendoza Province, Argentina",coronavirus en chile,"Villa Constitución, Santa Fe Province, Argentina",coronavirus hoy argentina,"Granadero Baigorria, Santa Fe Province, Argentina",coronavirus misiones,"Luján de Cuyo, Mendoza Province, Argentina",casos coronavirus argentina hoy,"Trenque Lauquen, Buenos Aires Province, Argentina",coronavirus en la pampa,"Funes, Santa Fe Province, Argentina",coronavirus en tucumán,"Lomas del Mirador, Buenos Aires Province, Argentina",coronavirus hoy en argentina,"Granadero Baigorria, Santa Fe Province, Argentina",coronavirus en tucumán,"Granadero Baigorria, Santa Fe Province, Argentina",rosario3,"Granadero Baigorria, Santa Fe Province, Argentina",coronavirus uruguay,"Tafí Viejo, Tucumán, Argentina",casos de coronavirus,"Las Vegas, Mendoza Province, Argentina",coronavirus santa fe,"Yerba Buena, Tucumán, Argentina",australia coronavirus,"Libertador General San Martín, Jujuy, Argentina",dolar blue,"Santa Fe, Santa Fe Province, Argentina",coronavirus en santa fe,"Recreo, Santa Fe Province, Argentina",cuantos casos de coronavirus hay en argentina hoy,"Tartagal, Salta Province, Argentina",dioxido de cloro,"Río Cuarto, Cordoba, Argentina",uruguay coronavirus,"Tartagal, Salta Province, Argentina",fantino coronavirus,"Las Vegas, Mendoza Province, Argentina",corrientes coronavirus,"Viedma, Río Negro, Argentina",vacuna contra el coronavirus,"Llavallol, Buenos Aires Province, Argentina",casos coronavirus argentina,"Santo Tomé, Santa Fe Province, Argentina",tucuman coronavirus,"Río Tercero, Cordoba, Argentina",fernando iglesias tiene coronavirus,"Esperanza, Santa Fe Province, Argentina",berni coronavirus,"Funes, Santa Fe Province, Argentina",casos de coronavirus,"Termas de Río Hondo, Santiago del Estero Province, Argentina",coronavirus china,"Granadero Baigorria, Santa Fe Province, Argentina",reforma judicial,"Santa Lucía, San Juan Province, Argentina",coronavirus tucuman,"Chimbas, San Juan Province, Argentina",coronavirus en san juan,"Rivadavia, San Juan Province, Argentina",coronavirus tandil,"Rivadavia, San Juan Province, Argentina",coronavirus en argentina hoy,"Rivadavia, San Juan Province, Argentina",coronavirus en rosario hoy,"Santa Lucía, San Juan Province, Argentina",coronavirus cordoba hoy,"Rivadavia, San Juan Province, Argentina",pronostico,"Chimbas, San Juan Province, Argentina",casos de coronavirus en argentina hoy,"Villa Aberastain, San Juan Province, Argentina",coronavirus españa,"Villa Aberastain, San Juan Province, Argentina",baby etchecopar coronavirus,"Granadero Baigorria, Santa Fe Province, Argentina",rosario coronavirus,"Villa Mercedes, San Luis Province, Argentina",casos de coronavirus hoy,"Maipú, Mendoza Province, Argentina",infobae coronavirus,"Luján de Cuyo, Mendoza Province, Argentina",coronavirus argentina hoy,"Rosario, Santa Fe Province, Argentina",rosario coronavirus,"Las Vegas, Mendoza Province, Argentina",patricia bullrich coronavirus,"Rosario, Santa Fe Province, Argentina",santa fe coronavirus,"Godoy Cruz, Mendoza Province, Argentina",casos coronavirus argentina,"Las Vegas, Mendoza Province, Argentina",casos de coronavirus en mendoza,"Godoy Cruz, Mendoza Province, Argentina",italia coronavirus hoy,"Granadero Baigorria, Santa Fe Province, Argentina",coronavirus argentina hoy,"Rosario, Santa Fe Province, Argentina",coronavirus en santa fe,"Villa Constitución, Santa Fe Province, Argentina",casos coronavirus,"Recreo, Santa Fe Province, Argentina",salta coronavirus,"Santo Tomé, Santa Fe Province, Argentina",casos de coronavirus en argentina hoy
