"San Isidro, Buenos Aires Province, Argentina",,"Villa Tesei, Buenos Aires Province, Argentina",coronavirus mundo hoy,"El Libertador, Buenos Aires Province, Argentina",chubut coronavirus,"Gerli, Buenos Aires Province, Argentina",catamarca,"Villa Ballester, Buenos Aires Province, Argentina",coronavirus en mendoza hoy,"Villa La Florida, Buenos Aires Province, Argentina",,"Ciudad Perico, Jujuy, Argentina",australia coronavirus,"Ramos Mejía, Buenos Aires Province, Argentina",,"El Libertador, Buenos Aires Province, Argentina",suecia coronavirus,"Morón, Buenos Aires Province, Argentina",coronavirus comodoro rivadavia,"Valentín Alsina, Buenos Aires Province, Argentina",,"San Fernando, Buenos Aires Province, Argentina",coronavirus israel,"Castelar, Buenos Aires Province, Argentina",,"Pablo Nogués, Buenos Aires Province, Argentina",,"Del Viso, Buenos Aires Province, Argentina",muertos coronavirus argentina,"Gerli, Buenos Aires Province, Argentina",colombia coronavirus,"Boulogne, Buenos Aires Province, Argentina",,"Carapachay, Buenos Aires Province, Argentina",permiso para circular,"Boulogne, Buenos Aires Province, Argentina",coronavirus casos hoy,"Trenque Lauquen, Buenos Aires Province, Argentina",,"Piñeiro, Buenos Aires Province, Argentina",coronavirus argentina hoy casos,"Lanús Oeste, Buenos Aires Province, Argentina",coronavirus en el mundo mapa,"Muñiz, Buenos Aires Province, Argentina",kicillof,"Santa Rosa, La Pampa Province, Argentina",coronavirus ushuaia,"Rincón de Milberg, Buenos Aires Province, Argentina",muertes coronavirus argentina,"Villa Luzuriaga, Buenos Aires Province, Argentina",cuba coronavirus,"Pinamar, Buenos Aires Province, Argentina",,"Quilmes, Buenos Aires Province, Argentina",coronavirus en córdoba,"San Isidro, Buenos Aires Province, Argentina",,"Lanús Oeste, Buenos Aires Province, Argentina",comorbilidades,"Rafael Calzada, Buenos Aires Province, Argentina",angela leiva,"Villa Domínico, Buenos Aires Province, Argentina",coronavirus en mar del plata hoy,"San Antonio de Padua, Buenos Aires Province, Argentina",vacuna covid,"Valentín Alsina, Buenos Aires Province, Argentina",,"San Miguel de Tucumán, Tucumán, Argentina",,"Haedo, Buenos Aires Province, Argentina",coronavirus en la argentina,"Muñiz, Buenos Aires Province, Argentina",pergamino coronavirus,"El Libertador, Buenos Aires Province, Argentina",,"Parana, Entre Rios, Argentina",contexto,"Haedo, Buenos Aires Province, Argentina",alejandro fantino,"San Nicolás de los Arroyos, Buenos Aires Province, Argentina",,"Quilmes Oeste, Buenos Aires Province, Argentina",,"Adrogué, Buenos Aires Province, Argentina",champions league,"Munro, Buenos Aires Province, Argentina",,"San Fernando, Buenos Aires Province, Argentina",fantino coronavirus,"Mendoza, Mendoza Province, Argentina",coronavirus count gbtnews,"Lomas de Zamora, Buenos Aires Province, Argentina",coronavirus mendoza hoy,"Jujuy, Jujuy, Argentina",como se si tengo coronavirus,"Del Viso, Buenos Aires Province, Argentina",,"San Antonio de Padua, Buenos Aires Province, Argentina",,"Ramos Mejía, Buenos Aires Province, Argentina",coronavirus en francia,"Lomas de Zamora, Buenos Aires Province, Argentina",crimenes de familia,"Martínez, Buenos Aires Province, Argentina",cuantos casos de coronavirus hay,"Ramos Mejía, Buenos Aires Province, Argentina",coronavirus europa,"Salta, Salta Province, Argentina",,"Salta, Salta Province, Argentina",eduardo feinmann tiene coronavirus,"Río Cuarto, Cordoba, Argentina",marca,"La Tablada, Buenos Aires Province, Argentina",coronavirus la plata,"San Lorenzo, Santa Fe Province, Argentina",tiempo hoy,"Avellaneda, Buenos Aires Province, Argentina",coronavirus argentina infobae,"Ramos Mejía, Buenos Aires Province, Argentina",asintomatico de coronavirus,"Luján, Buenos Aires Province, Argentina",,"Castelar, Buenos Aires Province, Argentina",coronavirus mendoza hoy,"Trenque Lauquen, Buenos Aires Province, Argentina",venezuela coronavirus,"Ituzaingó, Buenos Aires Province, Argentina",bullrich,"Villa Allende, Cordoba, Argentina",casos coronavirus caba,"Udaondo, Buenos Aires Province, Argentina",bahia blanca coronavirus,"Santo Tomé, Santa Fe Province, Argentina",adrian suar,"Libertador General San Martín, Jujuy, Argentina",,"Tapiales, Buenos Aires Province, Argentina",ludmila,"Rafaela, Santa Fe Province, Argentina",remax,"Castelar, Buenos Aires Province, Argentina",,"Lanús Oeste, Buenos Aires Province, Argentina",,"Corrientes, Corrientes Province, Argentina",barcelona
"Berazategui, Buenos Aires Province, Argentina",,"Buenos Aires (Argentina), ZZ-ZZZZ, ZZ",,"Remedios de Escalada, Buenos Aires Province, Argentina",mica viciconte,"Villa Allende, Cordoba, Argentina",cuarentena argentina,"Villa Maipú, Buenos Aires Province, Argentina",coronavirus argentina cordoba,"Ciudadela, Buenos Aires Province, Argentina",,"Ituzaingó, Buenos Aires Province, Argentina",quiniela,"Tortuguitas, Buenos Aires Province, Argentina",,"Rincón de Milberg, Buenos Aires Province, Argentina",ministerio de salud,"Buenos Aires (Argentina), ZZ-ZZZZ, ZZ",vacunas coronavirus,"Malvinas Argentinas, Buenos Aires Province, Argentina",,"Buenos Aires (Argentina), ZZ-ZZZZ, ZZ",coronavirus casos mundo,"Ramos Mejía, Buenos Aires Province, Argentina",,"Morón, Buenos Aires Province, Argentina",,"Martínez, Buenos Aires Province, Argentina",uruguay,"Ituzaingó, Buenos Aires Province, Argentina",river,"San Martín, Mendoza Province, Argentina",,"Luis Guillon, Buenos Aires Province, Argentina",la plata coronavirus,"Gerli, Buenos Aires Province, Argentina",coronavirus en el mundo hoy,"Ituzaingó, Buenos Aires Province, Argentina",,"Remedios de Escalada, Buenos Aires Province, Argentina",ife,"Vicente López, Buenos Aires Province, Argentina",dioxido de cloro,"Lanús Este, Buenos Aires Province, Argentina",calvicie coronavirus,"Vicente López, Buenos Aires Province, Argentina",el once,"Ciudad Perico, Jujuy, Argentina",mdz,"Udaondo, Buenos Aires Province, Argentina",coronavirus en la pampa hoy,"Ramos Mejía, Buenos Aires Province, Argentina",,"Lomas de Zamora, Buenos Aires Province, Argentina",lizy tagliani,"La Tablada, Buenos Aires Province, Argentina",,"Villa Constitución, Santa Fe Province, Argentina",el litoral coronavirus santa fe,"Victoria, Buenos Aires Province, Argentina",coronavirus japon,"Ramos Mejía, Buenos Aires Province, Argentina",mdz online coronavirus,"San Isidro, Buenos Aires Province, Argentina",coronavirus en eeuu,"Carapachay, Buenos Aires Province, Argentina",,"Ituzaingó, Buenos Aires Province, Argentina",,"Castelar, Buenos Aires Province, Argentina",venezuela coronavirus,"Jujuy, Jujuy, Argentina",coronavirus pergamino,"Carapachay, Buenos Aires Province, Argentina",,"Villa Elisa, Buenos Aires Province, Argentina",el tribuno,"Avellaneda, Buenos Aires Province, Argentina",coronavirus 8 de agosto argentina,"Victoria, Buenos Aires Province, Argentina",,"Pablo Nogués, Buenos Aires Province, Argentina",,"Funes, Santa Fe Province, Argentina",coronavirus cordoba hoy,"Villa Luzuriaga, Buenos Aires Province, Argentina",,"San Lorenzo, Santa Fe Province, Argentina",españa coronavirus hoy,"Parana, Entre Rios, Argentina",berni con coronavirus,"Temperley, Buenos Aires Province, Argentina",el litoral,"Del Viso, Buenos Aires Province, Argentina",,"Wilde, Buenos Aires Province, Argentina",,"Luis Guillon, Buenos Aires Province, Argentina",,"Adrogué, Buenos Aires Province, Argentina",feiman tiene coronavirus,"Llavallol, Buenos Aires Province, Argentina",coronavirus hoy mundo,"Castelar, Buenos Aires Province, Argentina",solange,"Jujuy, Jujuy, Argentina",cuantos casos de coronavirus hay en mendoza,"Gerli, Buenos Aires Province, Argentina",,"Lanús Este, Buenos Aires Province, Argentina",clima cordoba,"Ramos Mejía, Buenos Aires Province, Argentina",el tribuno salta,"Lanús Oeste, Buenos Aires Province, Argentina",coronavirus rosario hoy,"Santo Tomé, Santa Fe Province, Argentina",coronavirus san luis hoy,"Ramos Mejía, Buenos Aires Province, Argentina",caba coronavirus,"Orán, Salta Province, Argentina",tratamiento coronavirus,"Wilde, Buenos Aires Province, Argentina",,"Yerba Buena, Tucumán, Argentina",paises con mas casos de coronavirus,"Villa Mercedes, San Luis Province, Argentina",como saber si tienes coronavirus,"Castelar, Buenos Aires Province, Argentina",asintomatico de coronavirus,"Trenque Lauquen, Buenos Aires Province, Argentina",rosario,"Villa Aberastain, San Juan Province, Argentina",ministerio de salud,"Ramos Mejía, Buenos Aires Province, Argentina",djokovic,"Remedios de Escalada, Buenos Aires Province, Argentina",,"Ramos Mejía, Buenos Aires Province, Argentina",casos coronavirus buenos aires argentina,"Avellaneda, Buenos Aires Province, Argentina",que es el plasma para el coronavirus,"Hurlingham, Buenos Aires Province, Argentina",,"El Libertador, Buenos Aires Province, Argentina",,"Haedo, Buenos Aires Province, Argentina",coronavirus mapa mundial
"Quilmes, Buenos Aires Province, Argentina",,"San Lorenzo, Santa Fe Province, Argentina",,"Fátima, Buenos Aires Province, Argentina",casos en argentina coronavirus,"Morón, Buenos Aires Province, Argentina",coronavirus en bahia blanca,"William C. Morris, Buenos Aires Province, Argentina",coronavirus casos,"Avellaneda, Buenos Aires Province, Argentina",,"Villa Luzuriaga, Buenos Aires Province, Argentina",ambito financiero,"Morón, Buenos Aires Province, Argentina",,"Villa Gobernador Galvez, Santa Fe Province, Argentina",coronavirus en china,"Piñeiro, Buenos Aires Province, Argentina",jeanine añez coronavirus,"La Tablada, Buenos Aires Province, Argentina",,"Concepción del Uruguay, Entre Rios, Argentina",argentina coronavirus casos,"Hurlingham, Buenos Aires Province, Argentina",,"Udaondo, Buenos Aires Province, Argentina",,"Lomas del Mirador, Buenos Aires Province, Argentina",curva coronavirus,"Guillermo Hudson, Buenos Aires Province, Argentina",la gaceta,"Tartagal, Salta Province, Argentina",,"Boulogne, Buenos Aires Province, Argentina",coronavirus barcelona,"Piñeiro, Buenos Aires Province, Argentina",coronavirus misiones,"Villa Domínico, Buenos Aires Province, Argentina",,"Victoria, Buenos Aires Province, Argentina",casos coronavirus rosario,"La Tablada, Buenos Aires Province, Argentina",coronavirus en tucumán,"Villa Gobernador Galvez, Santa Fe Province, Argentina",notitimba,"San Fernando, Buenos Aires Province, Argentina",como saber si tengo coronavirus,"Temperley, Buenos Aires Province, Argentina",muertes por coronavirus,"Bella Vista, Buenos Aires Province, Argentina",cuales son los síntomas del coronavirus,"Dock Sud, Buenos Aires Province, Argentina",,"Jose Leon Suarez, Buenos Aires Province, Argentina",suecia coronavirus,"Piñeiro, Buenos Aires Province, Argentina",,"San Pedro de Jujuy, Jujuy, Argentina",comorbilidades significado,"Villa Gobernador Galvez, Santa Fe Province, Argentina",coronavirus hoy en el mundo,"Bella Vista, Buenos Aires Province, Argentina",0223 noticias coronavirus,"Río Cuarto, Cordoba, Argentina",rosario 3,"Piñeiro, Buenos Aires Province, Argentina",,"Bella Vista, Buenos Aires Province, Argentina",,"Lanús Este, Buenos Aires Province, Argentina",coronavirus casos mundo,"Buenos Aires (Argentina), ZZ-ZZZZ, ZZ",catamarca coronavirus,"Libertador General San Martín, Jujuy, Argentina",,"El Libertador, Buenos Aires Province, Argentina",subsidio coronavirus,"Mendoza, Mendoza Province, Argentina",temperatura,"Ciudadela, Buenos Aires Province, Argentina",,"Victoria, Buenos Aires Province, Argentina",,"Munro, Buenos Aires Province, Argentina",coronavirus en eeuu,"San Andrés, Buenos Aires Province, Argentina",,"Las Heras, Mendoza Province, Argentina",servicio meteorológico nacional,"Martínez, Buenos Aires Province, Argentina",permiso circulacion,"Buenos Aires (Argentina), ZZ-ZZZZ, ZZ",china coronavirus,"Lanús Este, Buenos Aires Province, Argentina",,"Temperley, Buenos Aires Province, Argentina",,"Villa Domínico, Buenos Aires Province, Argentina",,"La Tablada, Buenos Aires Province, Argentina",eduardo,"Udaondo, Buenos Aires Province, Argentina",coronavirus en tandil hoy,"Junín, Buenos Aires Province, Argentina",san juan,"Wilde, Buenos Aires Province, Argentina",coronavirus graph gbtnews,"Rafaela, Santa Fe Province, Argentina",,"Bernal, Buenos Aires Province, Argentina",messi se va,"Don Torcuato, Buenos Aires Province, Argentina",notitimba,"San Andrés, Buenos Aires Province, Argentina",coronavirus chaco,"Wilde, Buenos Aires Province, Argentina",fallecidos por coronavirus,"Buenos Aires (Argentina), ZZ-ZZZZ, ZZ",covid-19,"Rafaela, Santa Fe Province, Argentina",casos de coronavirus en corrientes,"Villa Martelli, Buenos Aires Province, Argentina",,"Don Bosco, Buenos Aires Province, Argentina",claudia fontan,"Lanús Este, Buenos Aires Province, Argentina",jorge messi,"Banfield, Buenos Aires Province, Argentina",coronavirus en córdoba,"San Antonio de Padua, Buenos Aires Province, Argentina",coronavirus eeuu hoy,"Bernal, Buenos Aires Province, Argentina",nuevos casos de coronavirus,"Avellaneda, Buenos Aires Province, Argentina",curva coronavirus,"Ituzaingó, Buenos Aires Province, Argentina",,"Boulogne, Buenos Aires Province, Argentina",ministerio de salud,"Banfield, Buenos Aires Province, Argentina",,"Villa Martelli, Buenos Aires Province, Argentina",,"San Fernando, Buenos Aires Province, Argentina",,"Castelar, Buenos Aires Province, Argentina",el gran premio de la cocina
"San Antonio de Padua, Buenos Aires Province, Argentina",,"Wilde, Buenos Aires Province, Argentina",,"Lanús Oeste, Buenos Aires Province, Argentina",villa dolores coronavirus,"Lanús Este, Buenos Aires Province, Argentina",miami coronavirus,"Rincón de Milberg, Buenos Aires Province, Argentina",rio negro coronavirus,"San Andrés, Buenos Aires Province, Argentina",,"Banfield, Buenos Aires Province, Argentina",dolores coronavirus,"Castelar, Buenos Aires Province, Argentina",,"Remedios de Escalada, Buenos Aires Province, Argentina",cuarentena argentina,"Vicente López, Buenos Aires Province, Argentina",mapa del coronavirus en el mundo,"Balcarce, Buenos Aires Province, Argentina",,"Villa Domínico, Buenos Aires Province, Argentina",coronavirus en entre rios hoy,"Lanús Oeste, Buenos Aires Province, Argentina",,"San Andrés, Buenos Aires Province, Argentina",,"Villa Domínico, Buenos Aires Province, Argentina",donde llamar por coronavirus,"Buenos Aires (Argentina), ZZ-ZZZZ, ZZ",coronavirus bariloche,"Munro, Buenos Aires Province, Argentina",,"Del Viso, Buenos Aires Province, Argentina",argentina coronavirus casos,"Lomas de Zamora, Buenos Aires Province, Argentina",promiedos,"San Pedro de Jujuy, Jujuy, Argentina",,"San Fernando, Buenos Aires Province, Argentina",vacuna del coronavirus,"Córdoba, Cordoba, Argentina",coronavirus corrientes,"Ituzaingó, Buenos Aires Province, Argentina",cuantos casos hubo hoy de coronavirus,"Villa Luzuriaga, Buenos Aires Province, Argentina",muertos coronavirus mundo,"Carapachay, Buenos Aires Province, Argentina",coronavirus en argentina hoy casos,"Tigre, Buenos Aires Province, Argentina",ministerio de salud de la nacion,"Jose Leon Suarez, Buenos Aires Province, Argentina",,"Del Viso, Buenos Aires Province, Argentina",minuto uno,"Mendoza, Mendoza Province, Argentina",,"Tandil, Buenos Aires Province, Argentina",cronista,"Villa Madero, Buenos Aires Province, Argentina",coronavirus chile hoy,"Dique Luján, Buenos Aires Province, Argentina",alan parker,"Villa Ballester, Buenos Aires Province, Argentina",coronavirus argentina casos hoy,"San Andrés, Buenos Aires Province, Argentina",,"Maipú, Mendoza Province, Argentina",,"Udaondo, Buenos Aires Province, Argentina",lmneuquen coronavirus,"Castelar, Buenos Aires Province, Argentina",coronavirus mar del plata hoy,"Quilmes, Buenos Aires Province, Argentina",,"Del Viso, Buenos Aires Province, Argentina",el eco de tandil coronavirus,"Miramar, Buenos Aires Province, Argentina",cantidad de muertos por coronavirus en argentina,"San Andrés, Buenos Aires Province, Argentina",,"Bella Vista, Buenos Aires Province, Argentina",,"Dique Luján, Buenos Aires Province, Argentina",ladrona,"Concepción, Tucumán, Argentina",,"Monte Chingolo, Buenos Aires Province, Argentina",zona roja coronavirus,"Wilde, Buenos Aires Province, Argentina",bahia blanca coronavirus,"Francisco Alvarez, Buenos Aires Province, Argentina",nuevos casos de coronavirus,"Villa Centenario, Buenos Aires Province, Argentina",,"Florida, Buenos Aires Province, Argentina",,"Buenos Aires (Argentina), ZZ-ZZZZ, ZZ",,"San Lorenzo, Santa Fe Province, Argentina",estadistica coronavirus,"Godoy Cruz, Mendoza Province, Argentina",cuantos casos hay en argentina de coronavirus,"Munro, Buenos Aires Province, Argentina",coronavirus en salta hoy,"Junín, Buenos Aires Province, Argentina",el pais,"Piñeiro, Buenos Aires Province, Argentina",,"Viedma, Río Negro, Argentina",,"Muñiz, Buenos Aires Province, Argentina",casos coronavirus mar del plata,"Wilde, Buenos Aires Province, Argentina",coronavirus santa fe hoy,"Ramos Mejía, Buenos Aires Province, Argentina",la pagina millonaria,"Villa Lynch, Buenos Aires Province, Argentina",coronavirus en cordoba hoy,"Banfield, Buenos Aires Province, Argentina",cuantos casos de coronavirus hay,"Rafael Calzada, Buenos Aires Province, Argentina",,"Buenos Aires (Argentina), ZZ-ZZZZ, ZZ",cronica,"Bernal, Buenos Aires Province, Argentina",nuevos sintomas del coronavirus,"San Antonio de Padua, Buenos Aires Province, Argentina",toti pasman,"Río Cuarto, Cordoba, Argentina",nuevas medidas en rosario por el coronavirus,"Martínez, Buenos Aires Province, Argentina",consejos sobre el coronavirus,"San Juan, San Juan Province, Argentina",españa,"Villa Madero, Buenos Aires Province, Argentina",,"Yerba Buena, Tucumán, Argentina",coronavirus en cordoba hoy,"El Libertador, Buenos Aires Province, Argentina",,"Ciudadela, Buenos Aires Province, Argentina",,"Villa Ballester, Buenos Aires Province, Argentina",,"El Palomar, Buenos Aires Province, Argentina",paraguay coronavirus
"Victoria, Buenos Aires Province, Argentina",,"El Libertador, Buenos Aires Province, Argentina",,"Rincón de Milberg, Buenos Aires Province, Argentina",coronavirus en entre ríos,"San Justo, Buenos Aires Province, Argentina",muertes por coronavirus en el mundo,"Haedo, Buenos Aires Province, Argentina",primeros sintomas del coronavirus,"Lanús Oeste, Buenos Aires Province, Argentina",,"Chascomús, Buenos Aires Province, Argentina",coronavirus cordoba hoy,"Llavallol, Buenos Aires Province, Argentina",,"Villa Allende, Cordoba, Argentina",el coronavirus esta en el aire,"Lomas de Zamora, Buenos Aires Province, Argentina",glee,"Wilde, Buenos Aires Province, Argentina",,"El Palomar, Buenos Aires Province, Argentina",corona virus en argentina,"Villa María, Cordoba, Argentina",,"Córdoba, Cordoba, Argentina",,"Lanús Este, Buenos Aires Province, Argentina",ultimas noticias,"Francisco Alvarez, Buenos Aires Province, Argentina",silvio marzolini,"Villa Ballester, Buenos Aires Province, Argentina",,"El Libertador, Buenos Aires Province, Argentina",santa isabel coronavirus,"Lomas del Mirador, Buenos Aires Province, Argentina",coronavirus argentina casos hoy,"Haedo, Buenos Aires Province, Argentina",,"Wilde, Buenos Aires Province, Argentina",vacuna para el coronavirus,"Ciudadela, Buenos Aires Province, Argentina",cuantos casos de coronavirus hay en mendoza,"Castelar, Buenos Aires Province, Argentina",coronavirus japon,"El Jagüel, Buenos Aires Province, Argentina",psg,"Roldán, Santa Fe Province, Argentina",viviana saccone,"Quilmes, Buenos Aires Province, Argentina",sintoma coronavirus,"Villa Domínico, Buenos Aires Province, Argentina",,"Munro, Buenos Aires Province, Argentina",cantando 2020,"Remedios de Escalada, Buenos Aires Province, Argentina",,"Morón, Buenos Aires Province, Argentina",japon coronavirus,"San Lorenzo, Santa Fe Province, Argentina",cuarentena en argentina,"Adrogué, Buenos Aires Province, Argentina",casos confirmados de coronavirus en argentina,"Tandil, Buenos Aires Province, Argentina",el litoral,"San Justo, Buenos Aires Province, Argentina",,"Villa Luzuriaga, Buenos Aires Province, Argentina",,"San Antonio de Padua, Buenos Aires Province, Argentina",alemania,"Martínez, Buenos Aires Province, Argentina",champions,"Haedo, Buenos Aires Province, Argentina",,"Santo Tomé, Santa Fe Province, Argentina",jujuy,"Godoy Cruz, Mendoza Province, Argentina",casos de coronavirus en tucumán,"Benavidez, Buenos Aires Province, Argentina",,"Villa Allende, Cordoba, Argentina",,"Quilmes, Buenos Aires Province, Argentina",coronavirus en argentina casos,"Don Torcuato, Buenos Aires Province, Argentina",,"Parana, Entre Rios, Argentina",turco wehbe,"Lanús Este, Buenos Aires Province, Argentina",coronavirus hoy en la argentina,"San Nicolás de los Arroyos, Buenos Aires Province, Argentina",casos coronavirus mendoza,"Banfield, Buenos Aires Province, Argentina",,"El Libertador, Buenos Aires Province, Argentina",,"Gerli, Buenos Aires Province, Argentina",,"Muñiz, Buenos Aires Province, Argentina",coronavirus en caucete,"El Palomar, Buenos Aires Province, Argentina",tandil,"El Libertador, Buenos Aires Province, Argentina",diario panorama,"Monte Chingolo, Buenos Aires Province, Argentina",coronavirus data gbtnews,"Villa Madero, Buenos Aires Province, Argentina",,"Lomas de Zamora, Buenos Aires Province, Argentina",,"Bernal, Buenos Aires Province, Argentina",oscar mediavilla,"Buenos Aires (Argentina), ZZ-ZZZZ, ZZ",cuarentena,"Florida, Buenos Aires Province, Argentina",eduardo feinmann salud,"Valentín Alsina, Buenos Aires Province, Argentina",argentina coronavirus hoy,"Adrogué, Buenos Aires Province, Argentina",coronavirus en el mundo cifras,"San Miguel de Tucumán, Tucumán, Argentina",,"Claypole, Buenos Aires Province, Argentina",dolar blue hoy,"San Andrés, Buenos Aires Province, Argentina",toti pasman,"Lanús Este, Buenos Aires Province, Argentina",coronavirus en bolivia,"San Isidro, Buenos Aires Province, Argentina",pandemia,"Buenos Aires (Argentina), ZZ-ZZZZ, ZZ",mi anses,"Castelar, Buenos Aires Province, Argentina",baby etchecopar,"Haedo, Buenos Aires Province, Argentina",,"Vicente López, Buenos Aires Province, Argentina",ambito financiero,"Ramos Mejía, Buenos Aires Province, Argentina",,"Valentín Alsina, Buenos Aires Province, Argentina",,"Esperanza, Santa Fe Province, Argentina",,"Hurlingham, Buenos Aires Province, Argentina",coronavirus en santiago del estero
